"line","word"
1,"porque es alegre"
2,"no, porque las pelotas no cantan "
3,"si, pelota la que le platico"
4,"no, porque no existe una pelota que canta "
5,"no, porqué una pelota no puee hablar."
6,"no, porque las pelotas no cantan "
7,"no,porqué no hablan"
8,"si,es una metafora "
9,"si, porqué te diviertes jugando con ella."
10,"si,es algo qué nos gusta y se puede decir así"
11,"no, porque en realidad es una metáfora y las metáforas son mentira "
12,"si, porqué se inspira "
13,"no, porque me gusta mucho la frase"
14,"si."
15,"si, es algo significativo o algo"
16,"si, porque va diciendo todo con la frase pelota"
17,"no, porque como que no se escucha bien"
18,"no, porque no no tiene vida y no tiene boca"
19,"no, porque no rima"
20,"no, si no todas las pelotas estuvieran cantando "
21,"no, porque no tienen boca"
22,"no, porque  no puede ser mi mamá una pelota que canta"
23,"si, porque  a cada rato canta"
24,"no, porque las pelotas no cantan "
25,"si, es como me dijieron mi mamá canta"
27,"no se canta ¡no tiene sentido!"
28,"si, porque si"
29,"no, porque nomas son pelotas"
30,"si, porque alguien se expresa con anhelo"
31,"no, porque mi mamá no canta"
32,"si, porque si rima"
33,"no, porque las pelotas solo se mueven"
34,"no, no sé"
35,"si, porque su máma canta"
36,"si, porque es cantada en todo"
37,"no, porque no puedo encontrar el ritmo del poema"
38,"si, a sentido figurado podría ser una radio"
39,"si, porqué si da sentido eso de pelotas"
40,"si, cuando una persona canta"
41,"no, porque las pelotas no cantan "
42,"si, porque es un juguete para rebotar, rodar y aventar."
43,"si, porqué suena muchas veces"
44,"si, porque canta"
45,"si,  figurado porque está hablando con pret"
46,"no, porqúe no existen esas pelotas y menos su familia"
47,"si, es un poema"
48,"si, se refiere a jugar"
49,"si, porque son juguetes"
50,"no, porqué no canta"
51,"si, porque lo revise 3"
52,"si, porque es una persona qué canta "
53,"no, porque es algo muy raro "
54,"no, porqué las pelotas no son seres vivos"
55,"si, porqué están describiendo a las personas y a los seres vivos como las pelotas"
56,"no, porque las pelotas no cantan "
57,"no, porque las pelotas no tienen boca"
58,"no, porque las pelotas no cantan "
59,"si, porque tu te puedes expresar"
60,"no, porque las pelotas no cantan "
61,"no, porque una pelota no pueden ser todas las cosas"
62,"no, porque las pelotas no cantan "
63,"si, porque rima*"
64,"si, porque es como si dijeras que una persona canta pero con pelotas"
65,"no, porque ninguna pelota puede cantar"
66,"no, porque las pelotas no cantan "
67,"no, porque las pelotas no hablan"
68,"no, porque las pelotas no cantan "
69,"no, porque una pelota no tiene boca"
70,"si, pelota en movimiento"
71,"no, porque las pelotas no cantan "
72,"si, porque es como si dijeras que alguien que canta"
73,"no, porque las pelotas no pueden cantar"
74,"si, porque habla mucho"
75,"no, porque las pelotas no cantan* "
76,"no, porque las pelotas no se mueven ni hablan"
77,"no, porque las pelotas no cantan"
78,"si, porque tal vez se refiere a que rebota"
79,"si, porque es redonda y circular"
80,"si, porque se refiere a objetos"
81,"no le entiendo"
82,"no, porque las pelotas no cantan"
83,"no, porque no rima tanto pelota que canta porque no termina igual"
84,"si, quiere decir que su mamá es una persona que canta"
85,"no, porque las pelotas no tienen boca"
86,"si, porque las mamas luego cantan"
87,"no, no se"
88,"si, porque habla de puras pelotas y cuando lo leí si tenía sentido"
89,"no, porque no tiene sentido"
90,"si, porque su mamá canta"
91,"no, porque no rima"
92,"no, porque las pelotas no cantan"
93,"no, porque las pelotas no hablan"
94,"no, porque las pelotas rebotan"
95,"no, porque las pelotas no cantan"
96,"no, porque las pelotas no cantan"
97,"no, porque las pelotas no cantan* "
98,"no, porque no rima"
99,"no, porque no rima"
100,"no, porque una pelota no canta "
101,"no, porque ninguna pelota canta"
102,"(dormido)"
103,"si, el sol es redondo y con fuego"
104,"no tiene sentido porque casi no rima"
105,"no, porque las pelotas no cantan* "
106,"no, mi mamá no canta o tal vez las demás igual no"
107,"si, porque tiene muchas rimas"
108,"si, tiene un poco de sentido"
109,"no, porque las pelotas no cantan* "
110,"si, porque cuando dice la pelota que canta se refiere a sus cabezas"
111,"no, porque no tiene ningun efecto"
112,"si, es una frase feliz y divertida y alegre"
113,"no, ninguna pelota puede cantar"
114,"si, porque rima*"
115,"no, porque las pelotas no cantan* "
116,"si, porque la mamá puede cantar"
117,"si, porque si se entiende"
118,"no, porque yo lo digo"
119,"si, porque dices una rima"
120,"no, porque las pelotas no cantan"
121,"no, porque ellas no hablan"
122,"no, porque las pelotas no cantan* "
123,"no, no sé"
124,"si, porque es como rima"
125,"no, no sé"
126,"no, porque las pelotas no cantan* "
127,"pelota que tiene ojos y boca, nariz y  habla"
128,"no, porque las pelotas rebotan no cantan"
129,"si, porque se le entiende a lo que dice"
130,"no, porque nadamas dices pelota"
131,"si, tiene sentido porque si pones una persona tiene sentido"
132,"si, porque le gusta cantar"
133,"no, porque las pelotas no cantan*"
134,"si, porque es como tu mamá cantara"
135,"no, es sentido figurado mas no literal"
136,"si, porque canta"
137,"si, porque puede ser una persona"
138,"no, porque las pelotas no cantan "
139,"no, porque no puede haber pelotas que canten en la vida real"
140,"no, porque las pelotas no cantan"
141,"si, porque al momento que rebota suena"
142,"no, porque la pelotas que cantan no existen"
143,"no, porque llas pelotas no tienen cerebro, entonces serían como unos zombies porque no tienen cerebro"
144,"si, porque tu mamá puede cantar"
145,"no, porque las pelotas no cantan"
146,"un señor que está gordito y canta"
147,"no, porque las pelotas no hablan*"
148,"si, porque puede referirse al sentido figurado como el poema, está escrito en figurado o literal"
149,"no, porque está en sentido figurado"
150,"si, eso creo yo"
151,"no, porque simplemente las pelotas no cantan"
152,"si, porque en un poema las frases no deben tener sentido, pero esto significa algo como que alguien canta porque no es literalmente lo que dice la frase."
153,"si, porque un poema tiene tipos de textos, literal y figurado, en figurado es: mi mamá canta"
154,"no, porque las pelotas no tienen boca"
155,"si, porque tiene algo de sentido"
156,"no, porque no tiene boca para hablar"
157,"si, porque se está refiriendo a cosas"
158,"no, porque las pelotas no hablan"
159,"si, porque está en sentido figurado"
160,"si, porque su mamá canta"
161,"no, porque no rima la frase"
162,"si, porque su mamá canta"
163,"no, porque las pelotas no cantan* "
164,"no, porque las pelotas no hablan *"
165,"si, porque mi mamá canta"
166,"no, porque las pelotas no cantan"
167,"si, porque es alguien que le gusta cantar"
168,"si, porque dice que su mamá canta"
169,"no, porque una pelota no tiene boca por eso no canta"
170,"si, porque una pelota representaría un objeto cualquiera"
171,"no, porque es una cosa material"
172,"no, porque no tienen suficientes palabras para explicar el poema"
173,"no, porque las pelotas solo son para jugar, no para cantar"
174,"no, porque las pelotas no cantan, es como si una pelota cantara despacito"
175,"no, porque yo no he visto una pelota que canta"
176,"si, porque se refiere a su mamá"
177,"no, porque las pelotas no cantan"
178,"no, porque las pelotas no hablan"
179,"no,porque no es tan comprensible"
180,"no,porque no puede haber un objeto que cante, eso sería imposible y absurdo "
181,"si, porque es una forma de describir a alguien"
182,"no, porque no hay pelotas que canten"
183,"no, porque las pelotas no cantan solo con la imaginación"
184,"no, porque las pelotas no hablan*"
185,"si, porque canta canciones"
186,"no, porque no creo que vaya a cantar"
187,"no, nadie entendería"
188,"si, porque se refiere a que su mamá canta"
189,"si, porque tiene muchas curvas"
190,"si,porque está hablando de su familia"
191,"no, es algo irónico"
192,"no, porque es una pelota normal"
193,"no, porque las pelotas no cantan"
194,"no, porque una pelota no puede cantar"
195,"si, porque es su forma de expresarse hacia las personas"
196,"no, porque las pelotas en si no pueden hablar"
197,"no, porque las pelotas no cantan* "
198,"no, porque las pelotas no tienen vida"
199,"no porque una pelota es una objeto inmovil"
200,"en la diversión en juego puede (hacer mas cosas??) en la pelota"
201,"no, porque las pelotas no hablan"
202,"no, porque las pelotas no pueden cantar y porque no tienen cuerdas vocales"
203,"no, porque las pelotas no cantan"
204,"no, porque las pelotas no cantan"
205,"no, porque una pelota se usa para jugar y porque es de plastico"
206,"no,porque las pelotas no hablan y si no hablan no cantan"
207,"si, porque si con pelotas se refieren a personas entonces sí, porque las mamás siempre cantan "
208,"si, porque mi mamá canta"
209,"no, porque las pelotas no cantan"
210,"no, porque las cosas no hablan"
211,"no, porque las pelotas no cantan"
212,"si, porque la tecnología hizo a sphero una pelota robot que habla y canta"
213,"no, porque dice cosas extrañas"
214,"no, porque la puedes botar, pero no va a cantar"
215,"no, porque las pelotas no hablan*"
216,"imaginénse una pelota cantar, no es normal"
217,"si, porque es una cancion que se va formando"
218,NA
219,"no, porque casi no se le entiende que quiere decir"
220,"no, porque una pelota no canta"
221,"si, porque rima poquito y habla sobre la familia"
222,"no, no rima y no tiene sentido de las palabras"
223,"si, porque se entiende que alguien de tu familia canta"
224,"no, no tiene sentido"
225,"si,todos tienen su chiste"
226,"no, porque no se escucha bien"
227,"si, porque luego las pelotas van en sentido contrario."
228,"si,su mama canta"
229,"si,porque su palabra significa algo"
230,"si,poema"
231,"si, porque luego las pelotas van en sentido contrario."
232,"si, porque a su mama le gusta cantar"
233,"si, porque mi mama canta"
234,"si, porque se explica lo que dice"
235,"si, porque rima"
236,"no, porque una pelota no canta*"
237,"no, es poema y no es cancion"
238,"si, porque describe una cosa o una persona"
239,"si, porque se oye bonito"
240,"si, porque mi mama canta"
241,"si, porque esta en sentido figurado pelota que canta es como alguien que canta"
242,"no, porque una pelota no canta"
243,"no porque las pelotas no cantan, pero puede que estuviera hablando en sentido figurado, seria una cara cantando."
244,"no, porque es tonta"
245,"si, porque algunas mamas cantan"
246,"no,porque no cantan"
247,"no, porque una pelota no canta"
248,"no, no tiene sentido"
249,"si, rima con no puedo contarlas"
250,"si,cada vez que rebota"
251,"si, porque el poema trata de pelota"
252,"si, porque rima con el poema"
253,"no, las pelotas no cantan"
254,"si, porque puede ser en mi imaginacion"
255,"no, ninguna pelota habla"
256,"si, porque a su mama le gusta cantar"
257,"si, porque es como si digieran el"
258,"no, porque no la conteste"
259,"si, porque compara a su familia"
260,"no, porque las pelotas no hablan"
261,"si, todo rima"
262,"si, porque indica que a la mama le gusta cantar"
263,"no, porque no lo entiendo"
264,"no, porque las pelotas no hablan"
265,"si, porque es fuego, plata y pelos..rima como pelota"
266,"si, porque suena a pelota"
267,"si, porque rima con el poema"
268,"no, porque las pelotas no hablan"
269,"si, porque la mama puede cantar"
270,"si, porque la persona es una pelota que canta mucho"
271,"no, porque las pelotas no cantan"
272,"si, porque se refiere a alguien que canta"
273,"no, porque las pelotas no hablan*"
274,"no,porque no cantan"
275,"no, porque no tiene sentido"
276,"no, porque las pelotas no cantan"
277,"no, porque las pelotas no cantan*"
278,"no, porque las pelotas no hablan*"
279,"si, porque la persona es una pelota que canta"
280,"no, porque las pelotas no cantan*"
281,"no, porque las pelotas no hablan*"
282,"si, porque a su mama le gusta cantar"
283,"no, porque las pelotas no cantan*"
284,"no, porque las pelotas no cantan*"
285,"si, es una persona que canta"
286,"si, es una persona que canta"
287,"si, es una persona que canta"
288,"no, porque las pelotas no cantan*"
289,"si, es una persona que canta"
290,"si,porque la mama canta"
291,"no, porque las pelotas no cantan*"
292,"no, porque no suena logico"
293,"si, porque puedes jugar con ella"
294,"no, no tiene sentido"
295,"no entiendo"
296,"no, porque las pelotas no cantan*"
297,"si, puede imaginar una pelota que canta"
298,"no, porque las pelotas no cantan*"
299,"no porque las pelotas no cantan*"
300,"si, todos cantan"
301,"no, porque no es redonda"
302,"no, porque las pelotas no cantan*"
303,"no entiendo"
304,"si, porque terminan con ta"
305,"si, porque a su mama le gusta cantar"
306,"si,porque tiene sentido"
307,"no, porque las pelotas no hablan*"
308,"si,porque tiene sentido"
309,"no, porque las pelotas no cantan*"
310,"si,tienen sentido"
311,"si,porque rebota"
312,"no, porque las pelotas no cantan*"
313,"no,porque no existen"
314,"si, porque rima"
315,"no, porque no tiene sentido"
316,"si, porque es un poema"
317,"no, porque las pelotas no cantan*"
318,"no, porque las pelotas no cantan*"
319,"no, porque las pelotas no cantan*"
320,"si,porque rima"
321,"no, porque las pelotas no cantan*"
322,"si, porque dice que su mama es una pelota que canta, o sea que es muy alegre y feliz"
323,"no, porque las pelotas no cantan*"
324,"no, porque las pelotas no cantan*"
325,"si, porque rima y ademas es un poema"
326,"no, porque las pelotas no cantan*"
327,"no, porque las pelotas no cantan*"
328,"si, porque su mama canta"
329,"no, porque ninguna pelota habla, menos que canta"
330,"si, tiene significado, creo que habla de la garganta o el chillido de una pelota"
331,"no, porque las pelotas no cantan*"
332,"si, porque a su mama le gusta cantar*"
333,"si, significa que su mama canta"
334,"no, las pelotas no tienen boca"
335,"no, porque las pelotas no cantan*"
336,"si, te demuestra que caracteres tiene tu familia"
337,"si, porque tiene sentido entre la pelota y lo demas"
338,"no, porque las pelotas no cantan*"
339,"si, mi mama canta"
340,"si, porque todas las personas las conocen por su redondez"
341,"no, porque no existe"
342,"no, porque las pelotas no hablan"
343,"no, porque las pelotas no cantan*"
344,"si, porque asi se demuestran las mamas cuando estan contentas o felices"
345,"si, porque canta la pelota cuando rebota"
346,"no, porque las pelotas no tienen boca"
347,"si, cuando nuestra mama nos regana nos grita, o tambien cuando no la obedecemos"
348,"no, porque las pelotas no cantan*"
349,"no, porque las pelotas no hablan*"
350,"si, porque habla sobre su mama"
351,"si, porque rima"
352,"si, porque dice en la cancion que toda tu familia parece pelotas"
353,"no, porque las pelotas no cantan*"
354,"no, porque las pelotas no cantan*"
355,"no, porque las pelotas no cantan*"
356,"no, porque las pelotas no cantan"
357,"no, porque no es una pelota que canta, sino una pelota cualquiera"
358,"no, porque las pelotas no cantan"
359,"no, porque las pelotas no pueden cantar porque no tienen boca*"
360,"no, porque las pelotas no cantan*"
361,"si, porque tenia varios ejemplos"
362,"si,porque todos los conocemos"
363,"no, porque no rima"
364,"si, porque todas las pelotas hacen lo que quieren"
365,"no, porque no se le entiende a la frase pelota"
366,"no, porque es obvio que ninguna ""pelota canta"""
367,"no, porque las pelotas no cantan*"
368,"si, porque cada vez que rebota su mama quiere cantar"
369,"no, porque las pelotas no cantan*"
370,"no,porque mi mama puede cantar, pero no todo el tiempo"
371,"no,porque esta en sentido figurado"
372,"si, porque su mama canta mucho y la describio como una pelota"
373,"no, porque es una pelota cualquiera"
374,"no,porque no todo es una pelota"
375,"no, porque no tiene sentido alguno"
376,"si, porque una mama puede cantar con una pelota"
377,"no, porque las pelotas no tienen boca"
378,"si, porque tu mama canta bonito"
379,"si, porque es una persona gordita que canta"
380,"no, porque las pelotas no hablan*"
381,"no, porque las pelotas no cantan*"
382,"no, porque su mama es un ser vivo y no un material"
383,"no, porque las pelotas no cantan*"
384,"no, porque las pelotas no cantan*"
385,"no, porque casi no rima"
386,"no, porque las pelotas ni se mueven ni cantan"
387,"no, porque las pelotas no cantan*"
388,"no, porque las pelotas no cantan"
389,"si, porque es mama que canta"
390,"no, porque las pelotas no cantan y la frase esta en sentido figurado"
391,"no, porque esta como insultando a las personas"
392,"si,porque se escucha bien y aparte si no tuviera sentido no la escuchariamos"
393,"no, porque es una expresion, yo creo que quiso decir """
394,"no, porque las pelotas no cantan*"
395,"no, porque las pelotas no cantan, esto se significa que esta hablando en sentido figurado"
396,"no, porque las pelotas no cantan, son para jugar"
397,"no, porque yo digo que no"
398,"no hay pelotas que puedan cantar aunque cuando rebotan hacen un ruido que parece como si cantaran"
399,"no, porque las pelotas no cantan*"
400,"no, porque es una frase que no existe y ademas es la frase ""pelota que canta"" no existe"
401,"no, porque las pelotas no cantan*"
402,"no, porque las pelotas no cantan*"
403,"yo no entiendo que significa esta frase"
404,"no, porque las pelotas no cantan*"
405,"no, porque no rima"
406,"no, porque las pelotas no cantan"
407,"si, porque es un poema y tiene palabras mezcladas con otras frases"
408,"no, porque las pelotas no cantan*"
409,"no, porque el sentimiento es de alegria"
410,"si, porque la pelota cada que rebota suena"
411,"no, porque las pelotas no cantan*"
412,"no porque las pelotas no cantan*"
413,"si, porque la pelota puede cantar"
414,"no, porque las pelotas no hablan"
415,"no, porque las pelotas no cantan (es una metafora)"
416,"no, porque las pelotas no cantan*"
417,"si, porque cuando la rebotas suena"
418,"no, porque es imposible que una pelota cante, aunque metaforicamente si"
419,"no porque las pelotas no hablan"
420,"si, porque su mama canta y la pelota tambien"
421,"no, porque las pelotas no cantan*"
422,"no, porque eso no existe"
423,"si, porque significa que su mama canta mucho"
424,"no, porque una pelota no canta ni habla, no tiene vida"
425,"si, porque son hermosas"
426,"no, porque ?como una pelota canta?"
427,"si, porque una pelota puede ser muchas cosas hasta una cabeza"
428,"no, porque las pelotas no cantan"
