103,leonardo andres hernandez,republica francesa,4,10,m,sol,3,luna,3,gato,3,"si, el sol es redondo y con fuego",1,,,que grita demasiado,3,NN,1,la luna es redonda y de color plata,3,PRUEBA 2,,,,,,,,,,,,,,,,,,,,,,,,,,,,,,,,,,,,,,,,,,,,,,,,,,,,,,,,,,,,,,,,,,,,,,PRUEBA 3,10,estrellas de cristal ,3,si,1,estrellas de luz,1,se pueden crear en esculruras,1,ml,cristal,luz,escultura,11,vestidos de tela ,3,si,1,vestidos ,1,ya estan creados,1,l,,,,12,zapatos de miel ,3,no,1,no se ,1,NN,1,a,,,,13,escultura de piedra ,3,si,1,arte,1,tembien se pueden crear,1,l,escultura,arte,,14,alma de hierro ,3,si,1,que eres muy fuerte,1,hay personas fuertes,1,m,hierro,fuerte,15,banqueta abrigadora ,3,no,1,NN,1,no se puede hacer,1,ai,,,16,la silla ya llego,3,no,1,NN,1,NN,1,a,,,17,los atletas corren ,3,si,1,que corren muy rapido,1,por que los atletas corren muy rapiso,1,l,atletas,rapido,18,el tiempo alcanza,0,si,0,NN,0,NN,0,ma,,,,cristina,10,estrellas de cristal ,3,si,1,estrellas de luz,1,se pueden crear en esculruras,1,ml,cristal,luz,escultura,11,vestidos de tela ,3,si,1,vestidos ,1,ya estan creados,1,l,,,,12,zapatos de miel ,3,no,1,NN,1,NN,1,a,,,,13,escultura de piedra ,3,si,1,arte,1,tembien se pueden crear,1,l,escultura,arte,,14,alma de hierro ,3,si,1,que eres muy fuerte,1,hay personas fuertes,1,m,hierro,fuerte,15,banqueta abrigadora ,3,no,1,NN,1,no se puede hacer,1,ai,,,16,la silla ya llego,3,no,1,NN,1,NN,1,a,,,17,los atletas corren ,3,si,1,que corren muy rapido,1,por que los atletas corren muy rapiso,1,l,atletas,rapido,18,el tiempo alcanza,0,si,0,NN,0,NN,0,ma,,,,cristina
104,genaro israel cruz sanchez,republica francesa,4,10,m,sol,3,luna,3,cabeza,1,,,no tiene sentido porque casi no rima,1,mi hermana es una pelota de risa,2,perro porque tiene mucho pelo,3,puede ser mi cabeza y puede ser un planeta,2,PRUEBA 2,,,,,,,,,,,,,,,,,,,,,,,,,,,,,,,,,,,,,,,,,,,,,,,,,,,,,,,,,,,,,,,,,,,,,,PRUEBA 3,10,estrellas de cristal ,2,no,1,NN,0,nunca he visto una estrella de cristal,1,mi,,,,11,vestidos de tela ,2,si,1,NN,0,por que si hay vestidos de tela,1,l,,,,12,zapatos de miel ,3,no,1,no se ,1,por que no hay zapatos de miel,1,ai,,,,13,escultura de piedra ,2,si,1,NN,0,por que si hay esculturas de piedra,1,l,,,,14,alma de hierro ,2,no,1,NN,0,por que no hay alma de hierra,1,mai,,,15,banqueta abrigadora ,2,no,1,NN,1,por que no hay bnquetas,0,ai,,,16,la silla ya llego,3,no,1,NN,1,NN,1,a,,,17,los atletas corren ,2,si,1,NN,0,por que si compiten los atletas,1,l,atletas,compiten,18,el tiempo alcanza,1,si,0,NN,0,por que alguna ves si da tiempo,1,m,,,,cristina,10,estrellas de cristal ,2,no,1,NN,0,nunca he visto una estrella de cristal,1,mi,,,,11,vestidos de tela ,2,si,1,NN,0,por que si hay vestidos de tela,1,l,,,,12,zapatos de miel ,3,no,1,NN,1,por que no hay zapatos de miel,1,ai,,,,13,escultura de piedra ,2,si,1,NN,0,por que si hay esculturas de piedra,1,l,,,,14,alma de hierro ,2,no,1,NN,0,por que no hay alma de hierra,1,mai,,,15,banqueta abrigadora ,2,no,1,NN,1,por que no hay bnquetas,0,ai,,,16,la silla ya llego,3,no,1,NN,1,NN,1,a,,,17,los atletas corren ,2,si,1,NN,0,por que si compiten los atletas,1,l,atletas,compiten,18,el tiempo alcanza,1,si,0,NN,0,por que alguna ves si da tiempo,1,m,,,,cristina
105,ubaldo acevedo,republica francesa,4,10,m,WW,1,WW,1,WW,1,,,"no, porque las pelotas no cantan",1,NN,1,NN,1,una pelota color plata,1,PRUEBA 2,,,,,,,,,,,,,,,,,,,,,,,,,,,,,,,,,,,,,,,,,,,,,,,,,,,,,,,,,,,,,,,,,,,,,,PRUEBA 3,10,estrellas de cristal ,2,no,1,NN,0,por que no hay estrellas de cristal,1,mi,,,,11,vestidos de tela ,2,si,1,tela,0,todos los vestidos son de tela,1,l,,,,12,zapatos de miel ,2,no,1,miel,0,los zapatos no son de miel,1,ai,,,,13,escultura de piedra ,1,no,0,piedra,1,NN,0,la,,,,14,alma de hierro ,0,no,0,NN,0,NN,0,ma,,,15,banqueta abrigadora ,3,no lo se,1,NN,1,NN,1,a,,,16,la silla ya llego,3,no,1,no se puede mover,1,la silla no corre,1,a,corre,,17,los atletas corren ,0,no lo se,0,NN,0,NN,0,la,,,18,el tiempo alcanza,3,si,1,se acaba,1,se acaba el dia,1,m,acaba,dia,,cristina,10,estrellas de cristal ,2,no,1,NN,0,por que no hay estrellas de cristal,1,mi,,,,11,vestidos de tela ,2,si,1,tela,0,todos los vestidos son de tela,1,l,,,,12,zapatos de miel ,2,no,1,miel,0,los zapatos no son de miel,1,ai,,,,13,escultura de piedra ,1,no,0,piedra,1,NN,0,la,,,,14,alma de hierro ,0,no,0,NN,0,NN,0,ma,,,15,banqueta abrigadora ,3,no lo se,1,NN,1,NN,1,a,,,16,la silla ya llego,3,no,1,no se puede mover,1,la silla no corre,1,a,corre,,17,los atletas corren ,0,no lo se,0,NN,0,NN,0,la,,,18,el tiempo alcanza,3,si,1,se acaba,1,se acaba el dia,1,m,acaba,dia,,cristina
106,adriel garac camargo dragustinovis,republica francesa,4,10,m,fuego,1,moneda,1,cabello,1,,,"no, mi mama no canta o tal vez las demas igual no",1,que ese hermanito llora mucho y grita mucho,3,el coco porque es redondo y circular y ademas tiene pelos,1,una moneda porque es de plata y redonda,1,PRUEBA 2,,,,,,,,,,,,,,,,,,,,,,,,,,,,,,,,,,,,,,,,,,,,,,,,,,,,,,,,,,,,,,,,,,,,,,PRUEBA 3,10,estrellas de cristal ,3,si,1,estrellas hechas de cristal,1,si es posible por que nunca dicen si es del espacioo de fabrica o echo a mano,1,m,,,,11,vestidos de tela ,3,si,1,un vestido hecho de tela,1,por que hay vestidos asi,1,l,,,,12,zapatos de miel ,3,no,1,zapatos dulces provenientes de abejas,1,no por que la miel se caeria y se extenderia en el piso,1,ami,dulces,abejas,,13,escultura de piedra ,3,si,1,escultura echa a mano con herramienta,1,por que ya gay esculturas de piedra,1,l,escultura,a mano,,14,alma de hierro ,3,si,1,alma dura persona dura,1,por que hay personas asi,1,mi,hierro,dura,15,banqueta abrigadora ,3,no  ,1,no significa nada no tiene sentido,1,por que no tiene sentido,1,a,,,16,la silla ya llego,3,no,1,no hay significado,1,por que no hay nada de significado,1,a,,,17,los atletas corren ,3,si,1,que personas corren,1,por que lo s atletas hacen eso,1,l,,,18,el tiempo alcanza,3,si,1,que el timepo te alcanza,1,por que es como que la hora te alcanza,1,m,tiempo,hora,,cristina,10,estrellas de cristal ,3,si,1,estrellas hechas de cristal,1,si es posible por que nunca dicen si es del espacioo de fabrica o echo a mano,1,m,,,,11,vestidos de tela ,3,si,1,un vestido hecho de tela,1,por que hay vestidos asi,1,l,,,,12,zapatos de miel ,3,no,1,zapatos dulces provenientes de abejas,1,no por que la miel se caeria y se extenderia en el piso,1,ami,dulces,abejas,,13,escultura de piedra ,3,si,1,escultura echa a mano con herramienta,1,por que ya gay esculturas de piedra,1,l,escultura,a mano,,14,alma de hierro ,3,si,1,alma dura persona dura,1,por que hay personas asi,1,mi,hierro,dura,15,banqueta abrigadora ,3,no  ,1,no significa nada no tiene sentido,1,por que no tiene sentido,1,a,,,16,la silla ya llego,3,no,1,no hay significado,1,por que no hay nada de significado,1,a,,,17,los atletas corren ,3,si,1,que personas corren,1,por que lo s atletas hacen eso,1,l,,,18,el tiempo alcanza,3,si,1,que el timepo te alcanza,1,por que es como que la hora te alcanza,1,m,tiempo,hora,,cristina
107,oscar omar de jesus garcia,republica francesa,4,10,m,pelota,1,que,1,a ,1,"si, porque tiene muchas rimas",1,,,que es muy gritona,3,NN,1,no tiene sentido,1,PRUEBA 2,,,,,,,,,,,,,,,,,,,,,,,,,,,,,,,,,,,,,,,,,,,,,,,,,,,,,,,,,,,,,,,,,,,,,,PRUEBA 3,10,estrellas de cristal ,2,no,1,una estrella de cristal,0,por que no puede dar una estrella de cristal,1,mi,,,,11,vestidos de tela ,3,si,1,como ropa normal,1,por que yo ya he visto un vestido de tela,1,l,vestido,ropa,,12,zapatos de miel ,2,no,1,zapatos de miel,0,por que no puede ver un zapato de miel,1,ai,,,,13,escultura de piedra ,3,si,1,escultura de piedra,1,por que si hay esculturas de piedra,1,l,,,,14,alma de hierro ,3,si,1,tu alma es muy fuerte,1,por que lo edisto es una pelicula,1,mi,hierro,fuerte,15,banqueta abrigadora ,3,no,1,que es una banqueta que te abriga,1,por que no existe,1,a,,,16,la silla ya llego,3,no,1,NN,1,por que una silla no camina,1,a,camina,,17,los atletas corren ,3,si,1,que corren,1,porque yo ya he ido a una carrera,1,l,atletas,carrera,18,el tiempo alcanza,0,,0,,0,NN,0,ma,,,,cristina,10,estrellas de cristal ,2,no,1,una estrella de cristal,0,por que no puede dar una estrella de cristal,1,mi,,,,11,vestidos de tela ,3,si,1,como ropa normal,1,por que yo ya he visto un vestido de tela,1,l,vestido,ropa,,12,zapatos de miel ,2,no,1,zapatos de miel,0,por que no puede ver un zapato de miel,1,ai,,,,13,escultura de piedra ,3,si,1,escultura de piedra,1,por que si hay esculturas de piedra,1,l,,,,14,alma de hierro ,3,si,1,tu alma es muy fuerte,1,por que lo edisto es una pelicula,1,mi,hierro,fuerte,15,banqueta abrigadora ,3,no,1,que es una banqueta que te abriga,1,por que no existe,1,a,,,16,la silla ya llego,3,no,1,NN,1,por que una silla no camina,1,a,camina,,17,los atletas corren ,3,si,1,que corren,1,porque yo ya he ido a una carrera,1,l,atletas,carrera,18,el tiempo alcanza,0,,0,,0,NN,0,ma,,,,cristina
108,bryan vladimir ramirez gonzalez,republica francesa,4,10,m,circulo,1,fuerte,1,circulo,1,"si, tiene un poco de sentido",1,,,que mi  hermano grita mucho,3,NN,1,que es muy brillante la pelota,2,PRUEBA 2,,,,,,,,,,,,,,,,,,,,,,,,,,,,,,,,,,,,,,,,,,,,,,,,,,,,,,,,,,,,,,,,,,,,,,PRUEBA 3,10,estrellas de cristal ,3,no,1,estrellas bonitas,1,no es posible,1,m,cristal,bonitas,,11,vestidos de tela ,3,si,1,vestido de varias telas,1,se pueden tejer,1,l,vestido,tejer,,12,zapatos de miel ,3,no,1,"que no ,e suena",1,no existe,1,a,,,,13,escultura de piedra ,3,si,1,varias eculturas de ?iedra,1,con un martillo y un palo puedes hacer esculturas,1,l,martillo,palo,,14,alma de hierro ,2,no,1,que eres fuerte,1,no es posible,0,mi,hierro,fuerte,15,banqueta abrigadora ,2,no,1,que esta dura,0,no es posible,1,ami,banqueta,dura,16,la silla ya llego,3,no,1,que si esta en la slla,1,no tiene sentido,1,a,,,17,los atletas corren ,3,si,1,son rapidos,1,si es real,1,l,atletas,rapidos,18,el tiempo alcanza,2,si,1,llego o lo haces a tiempo ,1,se entiende,0,m,,,,cristina,10,estrellas de cristal ,3,no,1,estrellas bonitas,1,no es posible,1,m,cristal,bonitas,,11,vestidos de tela ,3,si,1,vestido de varias telas,1,se pueden tejer,1,l,vestido,tejer,,12,zapatos de miel ,3,no,1,"que no ,e suena",1,no existe,1,a,,,,13,escultura de piedra ,3,si,1,varias eculturas de ?iedra,1,con un martillo y un palo puedes hacer esculturas,1,l,martillo,palo,,14,alma de hierro ,2,no,1,que eres fuerte,1,no es posible,0,mi,hierro,fuerte,15,banqueta abrigadora ,2,no,1,que esta dura,0,no es posible,1,ami,banqueta,dura,16,la silla ya llego,3,no,1,que si esta en la slla,1,no tiene sentido,1,a,,,17,los atletas corren ,3,si,1,son rapidos,1,si es real,1,l,atletas,rapidos,18,el tiempo alcanza,2,si,1,llego o lo haces a tiempo ,1,se entiende,0,m,,,,cristina
109,luis fernando gonzalez ramirez,republica francesa,4,10,m,sol,3,NN,1,cabeza,1,,,"no, porque las pelotas no cantan",1,que su hermano grita mucho,3,NN,1,no se me ocurre ninguna,1,PRUEBA 2,,,,,,,,,,,,,,,,,,,,,,,,,,,,,,,,,,,,,,,,,,,,,,,,,,,,,,,,,,,,,,,,,,,,,,PRUEBA 3,10,estrellas de cristal ,3,si,1,significa escultura,1,porque hay estrellas de escultura,1,ml,cristal,escultura,,11,vestidos de tela ,0,no,0,NN,0,no se ,0,,,,,12,zapatos de miel ,3,no,1,no se ,1,NN,1,a,,,,13,escultura de piedra ,0,no,0,NN,0,NN,0,,,,,14,alma de hierro ,0,no,0,NN,0,NN,0,ma,,,15,banqueta abrigadora ,3,no,1,NN,1,no se puede hacer,1,ai,,,16,la silla ya llego,3,no,1,NN,1,NN,1,a,,,17,los atletas corren ,3,si,1,que corren para  ganar,1,por que pueden ganar,1,l,atletas,ganar,18,el tiempo alcanza,3,si,1,que aun hay tiempo,1,por que aun puede haber tiempo de llegar a tiempo a un lugar,1,m,temprano,lugar,,cristina,10,estrellas de cristal ,3,si,1,significa escultura,1,porque hay estrellas de escultura,1,ml,cristal,escultura,,11,vestidos de tela ,0,no,0,NN,0,NN,0,,,,,12,zapatos de miel ,3,no,1,NN,1,NN,1,a,,,,13,escultura de piedra ,0,no,0,NN,0,NN,0,,,,,14,alma de hierro ,0,no,0,NN,0,NN,0,ma,,,15,banqueta abrigadora ,3,no,1,NN,1,no se puede hacer,1,ai,,,16,la silla ya llego,3,no,1,NN,1,NN,1,a,,,17,los atletas corren ,3,si,1,que corren para  ganar,1,por que pueden ganar,1,l,atletas,ganar,18,el tiempo alcanza,3,si,1,que aun hay tiempo,1,por que aun puede haber tiempo de llegar a tiempo a un lugar,1,m,temprano,lugar,,cristina
110,alan isaac centeno,republica francesa,4,10,m,sol,3,el arete,1,cabello,1,"si, porque cuando dice la pelota que canta se refiere a sus cabezas",2,,,que su hermano es griton,3,el vello porque cuando te lo quitas puedes hacer una pelota de vellos,2,que es un arete circular,1,PRUEBA 2,,,,,,,,,,,,,,,,,,,,,,,,,,,,,,,,,,,,,,,,,,,,,,,,,,,,,,,,,,,,,,,,,,,,,,PRUEBA 3,10,estrellas de cristal ,3,si,1,estrellas hechas de cristal,1,por que si se puede hacer,1,m,,,,11,vestidos de tela ,2,si,1,vestidos hechos con tela,1,por que los he visto que los venden,,l,,,,12,zapatos de miel ,3,no,1,no se ,1,por que se me hace imposible creer en eso,1,ai,,,,13,escultura de piedra ,2,si,1,una persona de piedra,,por que e visto,1,l,,,,14,alma de hierro ,0,no,0,NN,0,NN,0,ma,,,15,banqueta abrigadora ,3,no,1,NN,1,NN,1,a,,,16,la silla ya llego,3,si,1,NN,1,NN,1,a,,,17,los atletas corren ,3,si,1,que los atletas estan corriendo,1,porque salen en la tele o los ves pasar,1,l,,,18,el tiempo alcanza,2,si,1,que el tiempo siempre esta con nosotros,1,,0,m,,,,cristina,10,estrellas de cristal ,3,si,1,estrellas hechas de cristal,1,por que si se puede hacer,1,m,,,,11,vestidos de tela ,2,si,1,vestidos hechos con tela,1,por que los he visto que los venden,,l,,,,12,zapatos de miel ,3,no,1,NN,1,por que se me hace imposible creer en eso,1,ai,,,,13,escultura de piedra ,2,si,1,una persona de piedra,,por que e visto,1,l,,,,14,alma de hierro ,0,no,0,NN,0,NN,0,ma,,,15,banqueta abrigadora ,3,no,1,NN,1,NN,1,a,,,16,la silla ya llego,3,si,1,NN,1,NN,1,a,,,17,los atletas corren ,3,si,1,que los atletas estan corriendo,1,porque salen en la tele o los ves pasar,1,l,,,18,el tiempo alcanza,2,si,1,que el tiempo siempre esta con nosotros,1,,0,m,,,,cristina
111,angel gibran robledo leon,republica francesa,4,10,m,sol,3,luna,3,cabeza,1,,,"no, porque no tiene ningun efecto",1,que llora y grita cuando necesita algo,3,una pelota que tiene de adorno pelos,1,NN,1,PRUEBA 2,,,,,,,,,,,,,,,,,,,,,,,,,,,,,,,,,,,,,,,,,,,,,,,,,,,,,,,,,,,,,,,,,,,,,,PRUEBA 3,10,estrellas de cristal ,3,si,1,brillan bonito,1,sino la noche estara totalmente oscura,1,m,brilla,bonito,oscura,11,vestidos de tela ,2,si,1,suave liso y comodo,1,,,l,suave,liso,comodo,12,zapatos de miel ,2,no,1,no se ,1,,,,,,,13,escultura de piedra ,3,si,1,bonita grande,1,por que he visto esculturas hechas cin piedra,1,l,bonita,grande,,14,alma de hierro ,0,no,0,NN,0,,0,ma,,,15,banqueta abrigadora ,3,no,1,NN,1,,1,a,,,16,la silla ya llego,2,no,1,NN,1,,,a,,,17,los atletas corren ,3,si,1,para ponerse en forma,1,si no no estarian en forma,1,l,,,18,el tiempo alcanza,2,si,1,tener tiempo para alguna actividad,1,,0,m,tiempo,actividad,,cristina,10,estrellas de cristal ,3,si,1,brillan bonito,1,sino la noche estara totalmente oscura,1,m,brilla,bonito,oscura,11,vestidos de tela ,2,si,1,suave liso y comodo,1,,,l,suave,liso,comodo,12,zapatos de miel ,2,no,1,NN,1,,,,,,,13,escultura de piedra ,3,si,1,bonita grande,1,por que he visto esculturas hechas cin piedra,1,l,bonita,grande,,14,alma de hierro ,0,no,0,NN,0,,0,ma,,,15,banqueta abrigadora ,3,no,1,NN,1,,1,a,,,16,la silla ya llego,2,no,1,NN,1,,,a,,,17,los atletas corren ,3,si,1,para ponerse en forma,1,si no no estarian en forma,1,l,,,18,el tiempo alcanza,2,si,1,tener tiempo para alguna actividad,1,,0,m,tiempo,actividad,,cristina
112,jose gael cruz bautista,republica francesa,4,10,m,tio,2,hermano,3,mama,2,"si, es una frase feliz y divertida y alegre",2,,,que es muy divertido y grita mucho,3,mi primo es una pelota divertida,1,es una pelota muy divertida,2,PRUEBA 2,,,,,,,,,,,,,,,,,,,,,,,,,,,,,,,,,,,,,,,,,,,,,,,,,,,,,,,,,,,,,,,,,,,,,,PRUEBA 3,19,piernas de acero,2,no,0,que son muy resistentes,1,que son muy fuertes y pueden ser fuertes,1,m,acero,resistentes,fuertes,20,sobre de papel,3,si,1,es un sobre donde pones cosas,1,es donde puedes poner un papel adentro,1,l,,,,21,calendario de zacate,0,no,0,es un calendario diferente,0,yo creo que es un calendario diferente,0,a,,,,22,carbon ardiente,3,si,1,esque es muy fuerte,1,es un carbon que puede quemar demasiado,1,l,carbon,fuerte,quemar,23,ojos amargos,3,no,1,son unos ojos extanos,1,son unos ojos raros y extranos,1,m,raros,extranos,24,calceta de plata,3,no,1,es un tipo de calceta extrana,1,es un tipo de calceta extrana de colores,1,a,plata,color,25,la cebolla llega,0,si,0,tal ves ya sea un lugar,0,ya que se valla puede llegara aun punti,0,al,,,26,las gaviotas vuelan,3,si,1,por que sus plumas no pueden aguntar el aire,1,"no por que el aire consumo plumas, no puedes",1,li,plumas,aire,27,la noche llega,3,si,1,es es un anochver.,1,lanocje siuede lagar ,1,m,noche,anochecer,,cristina,19,piernas de acero,2,no,0,que son muy resistentes,1,que son muy fuertes y pueden ser fuertes,1,m,acero,resistentes,fuertes,20,sobre de papel,3,si,1,es un sobre donde pones cosas,1,es donde puedes poner un papel adentro,1,l,,,,21,calendario de zacate,0,no,0,es un calendario diferente,0,yo creo que es un calendario diferente,0,a,,,,22,carbon ardiente,3,si,1,esque es muy fuerte,1,es un carbon que puede quemar demasiado,1,l,carbon,fuerte,quemar,23,ojos amargos,3,no,1,son unos ojos extanos,1,son unos ojos raros y extranos,1,m,raros,extranos,24,calceta de plata,3,no,1,es un tipo de calceta extrana,1,es un tipo de calceta extrana de colores,1,a,plata,color,25,la cebolla llega,0,si,0,tal ves ya sea un lugar,0,ya que se valla puede llegara aun punti,0,al,,,26,las gaviotas vuelan,3,si,1,por que sus plumas no pueden aguntar el aire,1,"no por que el aire consumo plumas, no puedes",1,li,plumas,aire,27,la noche llega,3,si,1,es es un anochver.,1,lanocje siuede lagar ,1,m,noche,anochecer,,cristina
113,bryan ulises perez herrera,republica francesa,4,10,m,papa,1,eliod,1,hermano,2,,,"no, ninguna pelota puede cantar",1,que es muy gritona,3,"una pelota de oro, porque una pelota de pelos nadie la quiere",1,esta hecha de plata,1,PRUEBA 2,,,,,,,,,,,,,,,,,,,,,,,,,,,,,,,,,,,,,,,,,,,,,,,,,,,,,,,,,,,,,,,,,,,,,,PRUEBA 3,19,piernas de acero,3,si,1,que tiene piernas muy fuertes,1,por que si ases ejercicio tus piernas se ponene fuertes,1,m,acero,ejercicio,fuertes,20,sobre de papel ,3,no,1,que estas en el papel,1,por que si te pones sobre el papel de rompe,1,l,,,,21,calendario de zacate,3,si,1,esque tienes un calendario de papel,1,tu puedes hacer un calendario de pasto,1,a,calendario,pasto,,22,carbon ardiente,2,si ,1,que tienes temperatura,1,cuando tienes temparatura esta caliente,0,lm,ardiente,temperatura,,23,ojos amargos,3,si,1,cuando te arden,1,por que cuando te hachas limon a los ojos,1,ml,amargos,limon,24,calceta de plata,3,si,1,cuando tienes una calceta a color,1,tienes una calceta color plata,1,al,plata,color,25,la cebolla llega,2,no,1,una cebolla camina y llega a casa,0,una cebolla no camina,1,al,cebolla,no caminan,26,las gaviotas vuelan,3,si,1,las aves vuelan,1,todas las gavuiotas vuelan,1,l,,,27,la noche llega,3,si,1,hora se oscurecer,1,el sol se va y la luna llega,1,m,noche,luna,,cristina,19,piernas de acero,3,si,1,que tiene piernas muy fuertes,1,por que si ases ejercicio tus piernas se ponene fuertes,1,m,acero,ejercicio,fuertes,20,sobre de papel ,3,no,1,que estas en el papel,1,por que si te pones sobre el papel de rompe,1,l,,,,21,calendario de zacate,3,si,1,esque tienes un calendario de papel,1,tu puedes hacer un calendario de pasto,1,a,calendario,pasto,,22,carbon ardiente,2,si ,1,que tienes temperatura,1,cuando tienes temparatura esta caliente,0,lm,ardiente,temperatura,,23,ojos amargos,3,si,1,cuando te arden,1,por que cuando te hachas limon a los ojos,1,ml,amargos,limon,24,calceta de plata,3,si,1,cuando tienes una calceta a color,1,tienes una calceta color plata,1,al,plata,color,25,la cebolla llega,2,no,1,una cebolla camina y llega a casa,0,una cebolla no camina,1,al,cebolla,no caminan,26,las gaviotas vuelan,3,si,1,las aves vuelan,1,todas las gavuiotas vuelan,1,l,,,27,la noche llega,3,si,1,hora se oscurecer,1,el sol se va y la luna llega,1,m,noche,luna,,cristina
114,dante baruch gutierrez lopez,republica francesa,4,10,m,pelo,1,pelota,1,pelota,1,"si, porque rima",1,,,porque esta gordito y es griton,3,cabeza porque tiene pelos,1,que es una pelota de plata,1,PRUEBA 2,,,,,,,,,,,,,,,,,,,,,,,,,,,,,,,,,,,,,,,,,,,,,,,,,,,,,,,,,,,,,,,,,,,,,,PRUEBA 3,19,piernas de acero,1,no,0,que tengas piernas de piedra,1,porque existe,0,m,acero,pienas,piedra,20,sobre de papel,3,si,1,que sobro el papel,1,porque si puede ocurrir,1,l,,,,21,calendario de zacate,1,no,0,que es un calendario de zacate,1,asi puede haber un calendario de zacate,0,a,,,,22,carbon ardiente,3,si,1,que si el carbon es ardiente,1,por que si se puede se ta calienta el carbon,1,l,carbon,calienta,,23,ojos amargos,0,si,0,si puede sirve,0,tambien puede ser posible,0,ml,,,24,calceta de plata,1,no,1,que es una celsetare,0,no es posible.,0,ai,,,25,la cebolla llega,1,no,1,no es posible,0, no es posible,0,ai,,,26,las gaviotas vuelan,2,si,1,si es posible,0,si es posible por que si vuelan,1,l,,,27,la noche llega,2,si,1,tambiene s posible,0,tam bien es posible,1,m,,,,cristina,19,piernas de acero,1,no,0,que tengas piernas de piedra,1,porque existe,0,m,acero,pienas,piedra,20,sobre de papel,3,si,1,que sobro el papel,1,porque si puede ocurrir,1,l,,,,21,calendario de zacate,1,no,0,que es un calendario de zacate,1,asi puede haber un calendario de zacate,0,a,,,,22,carbon ardiente,3,si,1,que si el carbon es ardiente,1,por que si se puede se ta calienta el carbon,1,l,carbon,calienta,,23,ojos amargos,0,si,0,si puede sirve,0,tambien puede ser posible,0,ml,,,24,calceta de plata,1,no,1,que es una celsetare,0,no es posible.,0,ai,,,25,la cebolla llega,1,no,1,no es posible,0, no es posible,0,ai,,,26,las gaviotas vuelan,2,si,1,si es posible,0,si es posible por que si vuelan,1,l,,,27,la noche llega,2,si,1,tambiene s posible,0,tam bien es posible,1,m,,,,cristina
115,jose gilberto morales palacios,republica francesa,4,10,m,balon,1,senor,3,perro,3,,,"no, porque las pelotas no cantan",1,que grita mucho,3,perro tiene mucho pelo,3,que el de la tienda es muy buena persona,3,PRUEBA 2,,,,,,,,,,,,,,,,,,,,,,,,,,,,,,,,,,,,,,,,,,,,,,,,,,,,,,,,,,,,,,,,,,,,,,PRUEBA 3,19,piernas de acero,3,si,1,que te compras una pierna y te pongan otra ,1,por que si se te llega a romper una pierna la sacan y la unen una robotica de acero,1,ml,acero,robotica,,20,sobre de papel,3,si,1,que algo traspasa el papel,1,por que todo puede traspasar el papel,1,l,papel,traspasa,,21,calendario de zacate,2,si,1,que seas ingenioso,0,por que puede inventar cosas,1,a,,,,22,carbon ardiente,2,si,1,que un carbon esta prendido,1,que algo te qedo,0,l,carbon,prendido,,23,ojos amargos,3,si,1,que estas triste,1,cuando alguein te dice ojos amrgos es por que t e ve triste,1,m,amargos,triste,24,calceta de plata,3,si,1,que son calcetas caras,1,por que te puedes comprar calcetas caras,1,am,plata,cara,25,la cebolla llega,0,si,0,que te hace llorar,0,que te hace llorar,0,am,cebolla,llorar,26,las gaviotas vuelan,3,si,1,que vuelan,1,por que son aves,1,l,gaviotas ,aves,27,la noche llega,3,si,1,que hace sueno,1,que ya te quieres dormir,1,m,noche,sueno ,,cristina,19,piernas de acero,3,si,1,que te compras una pierna y te pongan otra ,1,por que si se te llega a romper una pierna la sacan y la unen una robotica de acero,1,ml,acero,robotica,,20,sobre de papel,3,si,1,que algo traspasa el papel,1,por que todo puede traspasar el papel,1,l,papel,traspasa,,21,calendario de zacate,2,si,1,que seas ingenioso,0,por que puede inventar cosas,1,a,,,,22,carbon ardiente,2,si,1,que un carbon esta prendido,1,que algo te qedo,0,l,carbon,prendido,,23,ojos amargos,3,si,1,que estas triste,1,cuando alguein te dice ojos amrgos es por que t e ve triste,1,m,amargos,triste,24,calceta de plata,3,si,1,que son calcetas caras,1,por que te puedes comprar calcetas caras,1,am,plata,cara,25,la cebolla llega,0,si,0,que te hace llorar,0,que te hace llorar,0,am,cebolla,llorar,26,las gaviotas vuelan,3,si,1,que vuelan,1,por que son aves,1,l,gaviotas ,aves,27,la noche llega,3,si,1,que hace sueno,1,que ya te quieres dormir,1,m,noche,sueno ,,cristina
116,natanael bernal medina,republica francesa,4,10,m,bombero,2,minero,2,perro,3,"si, porque la mama puede cantar",3,,,que grita mucho,3,un gato tiene pelos,3,el minero saca la platapor eso,2,PRUEBA 2,,,,,,,,,,,,,,,,,,,,,,,,,,,,,,,,,,,,,,,,,,,,,,,,,,,,,,,,,,,,,,,,,,,,,,PRUEBA 3,19,piernas de acero,3,no,1,que tiene las piernas duras,1,por que no se puede adherir a nuestras piernas,1,mli,acero,duro,,20,sobre de papel,3,si,1,un objeto,1,por que ya existe,1,l,papel,objeto,,21,calendario de zacate,3,no,1,no se,1,por que no se puede,1,a,,,,22,carbon ardiente,3,si,1,carbon que esta prendido,1,por que todo carbon se prende,1,l,carbon,prendido,,23,ojos amargos,2,no,1,NN,0,por que los ojos no se prueban,1,mai,,,24,calceta de plata,3,no,1,que se ven de plata,1,por que molestaria,1,ai,,,25,la cebolla llega,3,no,1,NN,1,por que no camina,1,ai,cebolla,no caminan,26,las gaviotas vuelan,3,si,1,que vuelan,1,por que tienen alas,1,l,gaviotas,alas,27,la noche llega,3,si,1,siemore llegara,1,por que da vueltas al planeta,1,ml,,,,cristina,19,piernas de acero,3,no,1,que tiene las piernas duras,1,por que no se puede adherir a nuestras piernas,1,mli,acero,duro,,20,sobre de papel,3,si,1,un objeto,1,por que ya existe,1,l,papel,objeto,,21,calendario de zacate,3,no,1,NN,1,por que no se puede,1,a,,,,22,carbon ardiente,3,si,1,carbon que esta prendido,1,por que todo carbon se prende,1,l,carbon,prendido,,23,ojos amargos,2,no,1,NN,0,por que los ojos no se prueban,1,mai,,,24,calceta de plata,3,no,1,que se ven de plata,1,por que molestaria,1,ai,,,25,la cebolla llega,3,no,1,NN,1,por que no camina,1,ai,cebolla,no caminan,26,las gaviotas vuelan,3,si,1,que vuelan,1,por que tienen alas,1,l,gaviotas,alas,27,la noche llega,3,si,1,siemore llegara,1,por que da vueltas al planeta,1,ml,,,,cristina
