70,dafne perez vazquez,colegio nuevo milenio,5,11,f,sol,3,luna,3,papa,3,"si, es una persona que canta",3,,,mi hermano grita mucho,3,"papa, porque se peina para arriba",3,luna es de ese color,3,PRUEBA 2,1,piel de papel,como es la piel?,,,,,,,,,2,flores de oro,como son las flores?,,,,,,,,,,3,corazones frios,como son los corazones?,,,,,,,,,,4,sonrisa tibia,como es la sonrisa?,,,,,,,,,,5,el ano va muy lento,que ocurre con el ano?,,,,,,,,,6,los segundos vuelan,que significa esta frase?,,,,,,,,,PRUEBA 3,,,,,,,,,,,,,,,,,,,,,,,,,,,,,,,,,,,,,,,,,,,,,,,,,,,,,,,,,,,,,,,,,,,,,,,,,,,,,,,,,,,,,,,,,,,,,,,,,,,,,,,,,,,,,,,,,,,,,,,,,,,,,,,,,,,,,,,,,,,,,,,,,,,,,,,,,,,,,,,,,,,,,,,,,,,,,,,,,,,,,,,,,,,,,,,,,,,,,,,,,,,,,,,,,,,,,,,,,,,,,,,,,,,,
71,maria fernanda gomez,colegio nuevo milenio,5,NA,f,vecino,2,papa,2,gato,3,"si, es una persona que canta",3,,,mi hermano grita mucho,3,"animales, son peludos",3,es fuerte,2,PRUEBA 2,1,piel de papel,como es la piel?,,,,,,,,,2,flores de oro,como son las flores?,,,,,,,,,,3,corazones frios,como son los corazones?,,,,,,,,,,4,sonrisa tibia,como es la sonrisa?,,,,,,,,,,5,el ano va muy lento,que ocurre con el ano?,,,,,,,,,6,los segundos vuelan,que significa esta frase?,,,,,,,,,PRUEBA 3,,,,,,,,,,,,,,,,,,,,,,,,,,,,,,,,,,,,,,,,,,,,,,,,,,,,,,,,,,,,,,,,,,,,,,,,,,,,,,,,,,,,,,,,,,,,,,,,,,,,,,,,,,,,,,,,,,,,,,,,,,,,,,,,,,,,,,,,,,,,,,,,,,,,,,,,,,,,,,,,,,,,,,,,,,,,,,,,,,,,,,,,,,,,,,,,,,,,,,,,,,,,,,,,,,,,,,,,,,,,,,,,,,,,
72,laura paola vargas fuentes,colegio nuevo milenio,5,NA,f,jaguar,2,amigo,3,tio,3,,,"no, porque las pelotas no cantan*",1,mi hermano grita mucho,3,"mi abuelita, es muy activa",2,donde estan las plantas,1,PRUEBA 2,1,piel de papel,como es la piel?,,,,,,,,,2,flores de oro,como son las flores?,,,,,,,,,,3,corazones frios,como son los corazones?,,,,,,,,,,4,sonrisa tibia,como es la sonrisa?,,,,,,,,,,5,el ano va muy lento,que ocurre con el ano?,,,,,,,,,6,los segundos vuelan,que significa esta frase?,,,,,,,,,PRUEBA 3,,,,,,,,,,,,,,,,,,,,,,,,,,,,,,,,,,,,,,,,,,,,,,,,,,,,,,,,,,,,,,,,,,,,,,,,,,,,,,,,,,,,,,,,,,,,,,,,,,,,,,,,,,,,,,,,,,,,,,,,,,,,,,,,,,,,,,,,,,,,,,,,,,,,,,,,,,,,,,,,,,,,,,,,,,,,,,,,,,,,,,,,,,,,,,,,,,,,,,,,,,,,,,,,,,,,,,,,,,,,,,,,,,,,
73,miriam alessandra sanchez r. ,colegio nuevo milenio,5,NA,f,nino,2,el,1,papa,3,"si, es una persona que canta",3,,,mi hermano grita mucho,3,"mi hermana, siempre se enoja",2,muy valioso,3,PRUEBA 2,1,piel de papel,como es la piel?,,,,,,,,,2,flores de oro,como son las flores?,,,,,,,,,,3,corazones frios,como son los corazones?,,,,,,,,,,4,sonrisa tibia,como es la sonrisa?,,,,,,,,,,5,el ano va muy lento,que ocurre con el ano?,,,,,,,,,6,los segundos vuelan,que significa esta frase?,,,,,,,,,PRUEBA 3,,,,,,,,,,,,,,,,,,,,,,,,,,,,,,,,,,,,,,,,,,,,,,,,,,,,,,,,,,,,,,,,,,,,,,,,,,,,,,,,,,,,,,,,,,,,,,,,,,,,,,,,,,,,,,,,,,,,,,,,,,,,,,,,,,,,,,,,,,,,,,,,,,,,,,,,,,,,,,,,,,,,,,,,,,,,,,,,,,,,,,,,,,,,,,,,,,,,,,,,,,,,,,,,,,,,,,,,,,,,,,,,,,,,
74,camila escamilla gonzales,republica francesa,4,9,f,balon ,1,moneda,1,cabeza ,1,"si,porque la mama canta",3,,,mi hermano grita mucho,3,cabeza ,1,moneda circular y plateada,1,PRUEBA 2,13,cabello de zacate,como es el cabello?,se tiene que utiizar suave como un zacate,,zacate,suave,,,metafora,1,8,dientes de perlas,como son los dientes?,son muy hermosos como si fueran perlas,,perlas,hermosos,,,,metafora,3,9,mi dulce hermana,como es mi hermana?,es algo dulce conmigo,,dulce,dulce,,,,literal,1,10,sonrisa de hielo,como es la sonrisa?,la sonrisa es bonita como un hielo,,hielo,bonita,,,,metafora,3,11,la noche quedo atras,que ocurrio con la noche?,se esconde cuando el sol sale,,quedo,esconder,,,metafora,3,12,vendran tiempos mejores,que significa esta frase?,que a veces estamos en tiempos dificiles,tiempos mejores,,tiempos dificiles,,,convencional,2,PRUEBA 3,,,,,,,,,,,,,,,,,,,,,,,,,,,,,,,,,,,,,,,,,,,,,,,,,,,,,,,,,,,,,,,,,,,,,,,,,,,,,,,,,,,,,,,,,,,,,,,,,,,,,,,,,,,,,,,,,,,,,,,,,,,,,,,,,,,,,,,,,,,,,,,,,,,,,,,,,,,,,,,,,,,,,,,,,,,,,,,,,,,,,,,,,,,,,,,,,,,,,,,,,,,,,,,,,,,,,,,,,,,,,,,,,,,,
75,lizeth abigail ontiveros,republica francesa,4,9,f,sol,3,luna,3,cabeza ,1,,,"no, porque las pelotas no cantan*",1,mi hermano grita mucho,3,NN,1,una moneda o joyas porque son de plata,1,PRUEBA 2,13,cabello de zacate,como es el cabello?,como una planta muy dura y tambien suave,,zacate,planta,duro,suave,metafora,2,8,dientes de perlas,como son los dientes?,son brillantes y bonitos,,perlas,brillantes,bonitos,,,metafora,3,9,mi dulce hermana,como es mi hermana?,puede ser mi amiga mi mejor con quien compartir mis preguntas,hermana,amiga,,,,,metafora,3,10,sonrisa de hielo,como es la sonrisa?,es muy fria porque es de hielo y seria como una sonrisa,,hielo,fria,,,,literal,1,11,la noche quedo atras,que ocurrio con la noche?,que una noche quedo otro dia,,,,,,metafora,2,12,vendran tiempos mejores,que significa esta frase?,que vendran tiempos mas llenos de amory felicidad,tiempos mejores,,amor,felicidad,,convencional,2,PRUEBA 3,,,,,,,,,,,,,,,,,,,,,,,,,,,,,,,,,,,,,,,,,,,,,,,,,,,,,,,,,,,,,,,,,,,,,,,,,,,,,,,,,,,,,,,,,,,,,,,,,,,,,,,,,,,,,,,,,,,,,,,,,,,,,,,,,,,,,,,,,,,,,,,,,,,,,,,,,,,,,,,,,,,,,,,,,,,,,,,,,,,,,,,,,,,,,,,,,,,,,,,,,,,,,,,,,,,,,,,,,,,,,,,,,,,,
76,ariadne carmona marquez,republica francesa,4,9,f,sol,3,luna,3,cabeza,1,,,"no, porque no suena logico",1,mi hermano grita mucho,3,gatos sueltan pelos,3,una moneda o joyas porque son de plata,1,PRUEBA 2,13,cabello de zacate,como es el cabello?,no tiene sentido,,,,,,no tiene sentido,1,8,dientes de perlas,como son los dientes?,son chiquitos blancos y tienen colmillos,dientes,chiquitos,colmillos,,,,desvinculado,1,9,mi dulce hermana,como es mi hermana?,no tengo hermanos,hermana,,no tengo hermanos,,,,desvinculada,1,10,sonrisa de hielo,como es la sonrisa?,"roja, agradable",sonrisa,,roja,agradable,,,desvinculado,1,11,la noche quedo atras,que ocurrio con la noche?,se fue la manana,,,,,,convencional,2,12,vendran tiempos mejores,que significa esta frase?,que vendran mas cositas mejores,tiempos mejores,,cosas buenas,,,convencional,2,PRUEBA 3,,,,,,,,,,,,,,,,,,,,,,,,,,,,,,,,,,,,,,,,,,,,,,,,,,,,,,,,,,,,,,,,,,,,,,,,,,,,,,,,,,,,,,,,,,,,,,,,,,,,,,,,,,,,,,,,,,,,,,,,,,,,,,,,,,,,,,,,,,,,,,,,,,,,,,,,,,,,,,,,,,,,,,,,,,,,,,,,,,,,,,,,,,,,,,,,,,,,,,,,,,,,,,,,,,,,,,,,,,,,,,,,,,,,
77,karen natalia castillo s.,republica francesa,4,9,f,meteorito,1,papa,3,perro,3,"si, porque puedes jugar con ella",2,,,mi hermano grita mucho,3,"gato, es peludo",3,consigue dinero para su familia,2,PRUEBA 2,13,cabello de zacate,como es el cabello?,tieso y rasposo,,zacate,tieso,rasposo ,,metafora,3,8,dientes de perlas,como son los dientes?,brillantes y blancos,,perlas,brillantes,blancos,,,metafora,3,9,mi dulce hermana,como es mi hermana?,carinoso,,dulce,carinosa,,,,metafora,3,10,sonrisa de hielo,como es la sonrisa?,no para de sonreir,,hielo,no para de sonreir,,,,metafora,3,11,la noche quedo atras,que ocurrio con la noche?,salio el sol,noche,quedo ,sol,,,convencional,2,12,vendran tiempos mejores,que significa esta frase?,que si te la pasaste mal habra el dia siguiente felicidad,tiempos mejores,,felicidad,,,convencional,2,PRUEBA 3,,,,,,,,,,,,,,,,,,,,,,,,,,,,,,,,,,,,,,,,,,,,,,,,,,,,,,,,,,,,,,,,,,,,,,,,,,,,,,,,,,,,,,,,,,,,,,,,,,,,,,,,,,,,,,,,,,,,,,,,,,,,,,,,,,,,,,,,,,,,,,,,,,,,,,,,,,,,,,,,,,,,,,,,,,,,,,,,,,,,,,,,,,,,,,,,,,,,,,,,,,,,,,,,,,,,,,,,,,,,,,,,,,,,
78,ailin gabriela quintanar,republica francesa,4,9,f,nino,2,arbol,1,papa,3,,,"no, no tiene sentido",1,mi hermano grita mucho,3,"papa, tiene pelo en brazos y barba",3,"arbol porque el podia hacerce de plata, hojas de plata, tallos de plata",1,PRUEBA 2,13,cabello de zacate,como es el cabello?,no entiendo,,,,,,NN,1,8,dientes de perlas,como son los dientes?,los dientes son blancos como perlas,,perlas,blancos,,,,metafora,3,9,mi dulce hermana,como es mi hermana?,es dulce osea amable y que respeta,,dulce,amable,respetable,,,metafora,3,10,sonrisa de hielo,como es la sonrisa?,es si la dejas mucho tiempo se siente fria como el hielo,,hielo ,fria,,,,metafora,2,11,la noche quedo atras,que ocurrio con la noche?,de que ya es de dia y la noche ya se fue osea la noche quedo atras,,quedo,se fue,,,metafora,3,12,vendran tiempos mejores,que significa esta frase?,de que tienes un mal dia y dices habra tiempos mejores,tiempos mejores,,mal dia ,,,convencional,2,PRUEBA 3,,,,,,,,,,,,,,,,,,,,,,,,,,,,,,,,,,,,,,,,,,,,,,,,,,,,,,,,,,,,,,,,,,,,,,,,,,,,,,,,,,,,,,,,,,,,,,,,,,,,,,,,,,,,,,,,,,,,,,,,,,,,,,,,,,,,,,,,,,,,,,,,,,,,,,,,,,,,,,,,,,,,,,,,,,,,,,,,,,,,,,,,,,,,,,,,,,,,,,,,,,,,,,,,,,,,,,,,,,,,,,,,,,,,
79,lizbeth sarahi quitana centeno,republica francesa,4,9,f,sol,3,luna,3,coco,3,,,NN,1,mi hermano grita mucho,3,cabeza de un perro,3,luna parece de plata,3,PRUEBA 2,,,,,,,,,,,,8,dientes de perlas,como son los dientes?,"blancos, brillosos, hermosos",,perlas,blancos,brilloso,hermoso,,metafora,3,9,mi dulce hermana,como es mi hermana?,"enojon, griton, chillon, dormilon, comelon, groseron, payason",,,,,,,desvinculada,1,10,sonrisa de hielo,como es la sonrisa?,"bonita, linda, hermosa",,hielo,bonita,hermosa,hermosa,,metafora,3,11,la noche quedo atras,que ocurrio con la noche?,NN,,,,,,NN,1,12,,,,,,,,,,,PRUEBA 3,,,,,,,,,,,,,,,,,,,,,,,,,,,,,,,,,,,,,,,,,,,,,,,,,,,,,,,,,,,,,,,,,,,,,,,,,,,,,,,,,,,,,,,,,,,,,,,,,,,,,,,,,,,,,,,,,,,,,,,,,,,,,,,,,,,,,,,,,,,,,,,,,,,,,,,,,,,,,,,,,,,,,,,,,,,,,,,,,,,,,,,,,,,,,,,,,,,,,,,,,,,,,,,,,,,,,,,,,,,,,,,,,,,,
80,angela regina sanchez rubio,republica francesa,4,9,f,NN,1,pelota plata,1,perro,3,,,"no, porque las pelotas no cantan*",1,mi hermano grita mucho,3,un lobo porque tiene pelos,3,una pelota de plata,1,PRUEBA 2,1,piel de papel,como es la piel?,,,,,,,,,2,flores de oro,como son las flores?,,,,,,,,,,3,corazones frios,como son los corazones?,,,,,,,,,,4,sonrisa tibia,como es la sonrisa?,,,,,,,,,,5,el ano va muy lento,que ocurre con el ano?,,,,,,,,,6,los segundos vuelan,que significa esta frase?,,,,,,,,,PRUEBA 3,,,,,,,,,,,,,,,,,,,,,,,,,,,,,,,,,,,,,,,,,,,,,,,,,,,,,,,,,,,,,,,,,,,,,,,,,,,,,,,,,,,,,,,,,,,,,,,,,,,,,,,,,,,,,,,,,,,,,,,,,,,,,,,,,,,,,,,,,,,,,,,,,,,,,,,,,,,,,,,,,,,,,,,,,,,,,,,,,,,,,,,,,,,,,,,,,,,,,,,,,,,,,,,,,,,,,,,,,,,,,,,,,,,,
81,julieta garcia castillo,republica francesa,4,9,f,sol,3,luna,3,cabeza ,1,"si, puede imaginar una pelota que canta",1,,,mi hermano grita mucho,3,los gatos o perros tienen pelos,3,luna aveces es obscura y plata tambien,3,PRUEBA 2,1,piel de papel,como es la piel?,,,,,,,,,2,flores de oro,como son las flores?,,,,,,,,,,3,corazones frios,como son los corazones?,,,,,,,,,,4,sonrisa tibia,como es la sonrisa?,,,,,,,,,,5,el ano va muy lento,que ocurre con el ano?,,,,,,,,,6,los segundos vuelan,que significa esta frase?,,,,,,,,,PRUEBA 3,,,,,,,,,,,,,,,,,,,,,,,,,,,,,,,,,,,,,,,,,,,,,,,,,,,,,,,,,,,,,,,,,,,,,,,,,,,,,,,,,,,,,,,,,,,,,,,,,,,,,,,,,,,,,,,,,,,,,,,,,,,,,,,,,,,,,,,,,,,,,,,,,,,,,,,,,,,,,,,,,,,,,,,,,,,,,,,,,,,,,,,,,,,,,,,,,,,,,,,,,,,,,,,,,,,,,,,,,,,,,,,,,,,,
82,romina hernandez,republica francesa,4,9,f,sol,3,luna,3,coco,3,,,"no, porque las pelotas no cantan*",1,mi hermano grita mucho,3,gato perro leon,3,una pelota de plata,1,PRUEBA 2,13,cabello de zacate,como es el cabello?,como seria un estropajo,,zacate,estropajo,,,literal,1,8,dientes de perlas,como son los dientes?,de perlas osea rosas y brillantes en bola,,perlas,rosas,bola,,,desvinculado,1,9,mi dulce hermana,como es mi hermana?,seria muy dulce con todos,,dulce,dulce,,,,literal,1,10,sonrisa de hielo,como es la sonrisa?,seria como si me sonrie se veria como su boca de hielo,,,,,,,imaginativa,1,11,la noche quedo atras,qoe ocurrio con la noche?,algo bueno que despues quedo en el pasa,,quedo ,pasado,,,metafora,3,12,vendran tiempos mejores,que significa esta frase?,que en el futuro me ira mejor,tiempos mejores,,mejor futuro,,,convencional,2,PRUEBA 3,,,,,,,,,,,,,,,,,,,,,,,,,,,,,,,,,,,,,,,,,,,,,,,,,,,,,,,,,,,,,,,,,,,,,,,,,,,,,,,,,,,,,,,,,,,,,,,,,,,,,,,,,,,,,,,,,,,,,,,,,,,,,,,,,,,,,,,,,,,,,,,,,,,,,,,,,,,,,,,,,,,,,,,,,,,,,,,,,,,,,,,,,,,,,,,,,,,,,,,,,,,,,,,,,,,,,,,,,,,,,,,,,,,,
83,natalia guadalupe hernandez,republica francesa,4,9,f,sol,3,luna,3,cabeza ,1,,,no porque las pelotas no cantan*,1,mi hermano grita mucho,3,gato porque es peludo,3,una pelota de plata es la luna,3,PRUEBA 2,13,cabello de zacate,como es el cabello?,largo y lacio,cabello,,largo,lacio ,,desvinculada,1,8,dientes de perlas,como son los dientes?,blancos y cuadrados,dientes,,blancos,cuadrados,,,desvinculado,1,9,mi dulce hermana,como es mi hermana?,linda mediana y guapa,,,,,,,desvinculada,1,10,sonrisa de hielo,como es la sonrisa?,linda,,hielo,linda,,,,metafora,3,11,la noche quedo atras,qoe ocurrio con la noche?,dormir,noche ,,domir,,,desvinculado ,1,12,vendran tiempos mejores,que significa esta frase?,que habra otro dia mejor que este,tiempos mejores,,otro dia mejor,,,convencional,2,PRUEBA 3,,,,,,,,,,,,,,,,,,,,,,,,,,,,,,,,,,,,,,,,,,,,,,,,,,,,,,,,,,,,,,,,,,,,,,,,,,,,,,,,,,,,,,,,,,,,,,,,,,,,,,,,,,,,,,,,,,,,,,,,,,,,,,,,,,,,,,,,,,,,,,,,,,,,,,,,,,,,,,,,,,,,,,,,,,,,,,,,,,,,,,,,,,,,,,,,,,,,,,,,,,,,,,,,,,,,,,,,,,,,,,,,,,,,
84,jennifer trejo diaz,republica francesa,4,9,f,sol,3,luna,3,pelota de pelos,1,"si, todos cantan",1,,,mi hermano grita mucho,3,cabello tiene pelos,1,luna como plata,3,PRUEBA 2,13,cabello de zacate,como es el cabello?,es rasposo y a veces suavecito,,zacate,raposo,suave,,metafora,3,8,dientes de perlas,como son los dientes?,muy blancos,,perlas,blancos,,,,metafora,3,9,mi dulce hermana,como es mi hermana?,mi hermano es lino y carinoso,,dulce,lindo,carinoso,,,metafora,3,10,sonrisa de hielo,como es la sonrisa?,bonita y grande,,hielo,bonita,grande,,,metafora,3,11,la noche quedo atras,qoe ocurrio con la noche?,que la noche se oculta y sale el sol,,quedo ,ocultar,,,metafora,3,12,vendran tiempos mejores,que significa esta frase?,que te pasaran mas adelante cosas bonitas,,,,,,convencional,2,PRUEBA 3,,,,,,,,,,,,,,,,,,,,,,,,,,,,,,,,,,,,,,,,,,,,,,,,,,,,,,,,,,,,,,,,,,,,,,,,,,,,,,,,,,,,,,,,,,,,,,,,,,,,,,,,,,,,,,,,,,,,,,,,,,,,,,,,,,,,,,,,,,,,,,,,,,,,,,,,,,,,,,,,,,,,,,,,,,,,,,,,,,,,,,,,,,,,,,,,,,,,,,,,,,,,,,,,,,,,,,,,,,,,,,,,,,,,
85,melanie joseline rodriguez,republica francesa,4,9,f,sol,3,luna,3,cabeza,1,,,"no, porque no es redonda",2,mi hermano grita mucho,3,coco tiene pelos,3,porque es redonda y brillante,3,PRUEBA 2,13,cabello de zacate,como es el cabello?,es muy duro y con pelitos,,zacate,duro,pelitos,,metafora,3,8,dientes de perlas,como son los dientes?,algunos son redondos un poco como cuadraditos,dientes,,redondos,cuadraditos,,,desvinculado,1,9,mi dulce hermana,como es mi hermana?,timida tiene un poco de miedo amabre y bonita,,dulce,amable ,bonita,,,metafora,3,10,sonrisa de hielo,como es la sonrisa?,NN,,,,,,,no se,1,11,la noche quedo atras,qoe ocurrio con la noche?,que ya salio el sol y la luna se quedo atras,,quedo ,salir ,,,metafora,3,12,vendran tiempos mejores,que significa esta frase?,que si en estos tiempos es mal vendran tiempos mejores,,,,,,convencional,2,PRUEBA 3,,,,,,,,,,,,,,,,,,,,,,,,,,,,,,,,,,,,,,,,,,,,,,,,,,,,,,,,,,,,,,,,,,,,,,,,,,,,,,,,,,,,,,,,,,,,,,,,,,,,,,,,,,,,,,,,,,,,,,,,,,,,,,,,,,,,,,,,,,,,,,,,,,,,,,,,,,,,,,,,,,,,,,,,,,,,,,,,,,,,,,,,,,,,,,,,,,,,,,,,,,,,,,,,,,,,,,,,,,,,,,,,,,,,
86,camila trejo camacho,republica francesa,4,9,f,sol,3,luna,3,cabeza,1,,,"no, porque las pelotas no cantan*",1,NN,1,la parte de arriba de un arbol,1,luna es redonda color plata,3,PRUEBA 2,13,cabello de zacate,como es el cabello?,una bola redonda con pelos,,zacate,bola,pelitos,,metafora,3,8,dientes de perlas,como son los dientes?,algunos son blancos y un poco redondos,dientes,,blancos,redondos,,,desvinculado,1,9,mi dulce hermana,como es mi hermana?,es bonita gordita amorosa y comprendente,,dulce,gordita,amorosa,,,metafora,3,10,sonrisa de hielo,como es la sonrisa?,NN,,,,,,,no se,1,11,la noche quedo atras,qoe ocurrio con la noche?,que ya salio el sol,,quedar atras ,salio el sol,,,metafora,3,12,vendran tiempos mejores,que significa esta frase?,habran momentos mejores que los que pasaste,tiempos mejores,,momentos mejores,,,convencional,2,PRUEBA 3,,,,,,,,,,,,,,,,,,,,,,,,,,,,,,,,,,,,,,,,,,,,,,,,,,,,,,,,,,,,,,,,,,,,,,,,,,,,,,,,,,,,,,,,,,,,,,,,,,,,,,,,,,,,,,,,,,,,,,,,,,,,,,,,,,,,,,,,,,,,,,,,,,,,,,,,,,,,,,,,,,,,,,,,,,,,,,,,,,,,,,,,,,,,,,,,,,,,,,,,,,,,,,,,,,,,,,,,,,,,,,,,,,,,
87,rosa fernanda olvera,republica francesa,4,9,f,coco,1,naranja,1,sacate,1,,,NN,1,mi hermano grita mucho,3,coco tiene pelos,3,NN,1,PRUEBA 2,13,cabello de zacate,como es el cabello?,es como un hilo,,zacate,hilo,,,desvinculada,1,8,dientes de perlas,como son los dientes?,fuertes y limpios,dientes,,fuertes,limpios,,,desvinculado,1,9,mi dulce hermana,como es mi hermana?,"gritona, chillona, graciosa",,,,,,,desvinculada,1,10,sonrisa de hielo,como es la sonrisa?,NN,,,,,,,nada,1,11,la noche quedo atras,qoe ocurrio con la noche?,se va el sol y pasa la luna y estrellas,,quedo ,se va,,,metafora,3,12,vendran tiempos mejores,que significa esta frase?,-,,,,,,,,PRUEBA 3,,,,,,,,,,,,,,,,,,,,,,,,,,,,,,,,,,,,,,,,,,,,,,,,,,,,,,,,,,,,,,,,,,,,,,,,,,,,,,,,,,,,,,,,,,,,,,,,,,,,,,,,,,,,,,,,,,,,,,,,,,,,,,,,,,,,,,,,,,,,,,,,,,,,,,,,,,,,,,,,,,,,,,,,,,,,,,,,,,,,,,,,,,,,,,,,,,,,,,,,,,,,,,,,,,,,,,,,,,,,,,,,,,,,
88,melannie montserrat g.,republica francesa,4,9,f,sol,3,luna,3,pelota de pelos,1,"si, porque terminan con ta",1,,,mi hermano grita mucho,3,cabello en tu cabeza,1,se refiere a una pelota de plata,1,PRUEBA 2,13,cabello de zacate,como es el cabello?,sedoso y brilloso,cabello,,sedoso,brilloso,,desvinculada,1,8,dientes de perlas,como son los dientes?,duros y blancos,dientes,perlas,duros,blancos,,,incierto,2,9,mi dulce hermana,como es mi hermana?,no tengo hermana,,,no tengo hermana,,,,desvinculada,1,10,sonrisa de hielo,como es la sonrisa?,NN,,,,,,,no se,1,11,la noche quedo atras,qoe ocurrio con la noche?,se oscurecio,noche ,,ocurecio,,,convencional,2,12,vendran tiempos mejores,que significa esta frase?,que hay mejores dias,tiempos mejores,,mejores dias ,,,convencional,2,PRUEBA 3,,,,,,,,,,,,,,,,,,,,,,,,,,,,,,,,,,,,,,,,,,,,,,,,,,,,,,,,,,,,,,,,,,,,,,,,,,,,,,,,,,,,,,,,,,,,,,,,,,,,,,,,,,,,,,,,,,,,,,,,,,,,,,,,,,,,,,,,,,,,,,,,,,,,,,,,,,,,,,,,,,,,,,,,,,,,,,,,,,,,,,,,,,,,,,,,,,,,,,,,,,,,,,,,,,,,,,,,,,,,,,,,,,,,
89,lidia genesis baldera,republica francesa,4,9,f,sol,3,el,1,hermanito,3,"si, porque a su mama le gusta cantar",3,,,mi hermano grita mucho,3,nada,1,yo digo explosion,1,PRUEBA 2,13,cabello de zacate,como es el cabello?,bueno yo creo que suave a veces cafe o negro,cabello,,suave,color,,desvinculada,1,8,dientes de perlas,como son los dientes?,los dientes son blancos muy fuertes,dientes,perlas,blancos,fuertes,,,incierto,2,9,mi dulce hermana,como es mi hermana?,pues muy buena amistosa y linda,,dulce,amistoso,linda,,,metafora,3,10,sonrisa de hielo,como es la sonrisa?,muy bonita y es parte cuerpo,sonrisa,hielo,bonita,cuerpo,,,incierta,2,11,la noche quedo atras,qoe ocurrio con la noche?,aun es de dia,,quedo ,dia ,,,metafora,2,12,vendran tiempos mejores,que significa esta frase?,que va a haber tiempos en familia y con amigos y va ir bien,,,,,,convencional,2,PRUEBA 3,,,,,,,,,,,,,,,,,,,,,,,,,,,,,,,,,,,,,,,,,,,,,,,,,,,,,,,,,,,,,,,,,,,,,,,,,,,,,,,,,,,,,,,,,,,,,,,,,,,,,,,,,,,,,,,,,,,,,,,,,,,,,,,,,,,,,,,,,,,,,,,,,,,,,,,,,,,,,,,,,,,,,,,,,,,,,,,,,,,,,,,,,,,,,,,,,,,,,,,,,,,,,,,,,,,,,,,,,,,,,,,,,,,,
90,liliana perez tellez,republica francesa,4,9,f,senor,1,mama,1,papa,1,"si,porque tiene sentido",2,,,mi hermano tiene una pelota de gritos,1,juntando muchos pelos y hacerlos bolas,1,que compren oro y lo hacen,1,PRUEBA 2,14,nubes de leche,como son las nubes?,son blancas como la leche,,leche,blancas,,,metafora,3,15,piel de seda,como es la piel,es muy suave del color carnita,piel,seda ,suave,carnita,,,incierto,2,16,mirada ardiente,como es la mirada?,mirada ardiente es cuando te quedas viendo mucho,,ardiente ,ver mucho ,,,,metafora,3,17,ojos amargos,como son los ojos?,como cuando te cae limon en los ojos,,amargos ,limon,,,,imaginativo,1,18,el verano viene,que ocurre con el verano?,verano,,calor,,,,metafora,2,19,la navidad llego,que significa esta frase?,arrullas al nino dios,navidad,,arrullas al nino dios,,,convencional ,2,PRUEBA 3,,,,,,,,,,,,,,,,,,,,,,,,,,,,,,,,,,,,,,,,,,,,,,,,,,,,,,,,,,,,,,,,,,,,,,,,,,,,,,,,,,,,,,,,,,,,,,,,,,,,,,,,,,,,,,,,,,,,,,,,,,,,,,,,,,,,,,,,,,,,,,,,,,,,,,,,,,,,,,,,,,,,,,,,,,,,,,,,,,,,,,,,,,,,,,,,,,,,,,,,,,,,,,,,,,,,,,,,,,,,,,,,,,,,
91,ximena alexandra guajardo,republica francesa,4,9,f,WW,0,WW,0,pelusa,1,,,"no, porque las pelotas no hablan*",1,mi hermano grita mucho,3,no se me ocurre nada,1,WW,0,PRUEBA 2,14,nubes de leche,como son las nubes?,que son blancas,nubes,leche,blancas,,,incierto ,2,15,piel de seda,como es la piel,que la piel es muy suabe,,seda ,suave,,,,metafora ,3,16,mirada ardiente,como es la mirada?,NN,,,,,,,NN,1,17,ojos amargos,como son los ojos?,no son amargos,,,,,,,imposible,1,18,el verano viene,que ocurre con el verano?,NN,,,,,,NN,1,19,la navidad llego,que significa esta frase?,de que va a hacer mucho frio,navidad,,frio,,,convencional ,2,PRUEBA 3,,,,,,,,,,,,,,,,,,,,,,,,,,,,,,,,,,,,,,,,,,,,,,,,,,,,,,,,,,,,,,,,,,,,,,,,,,,,,,,,,,,,,,,,,,,,,,,,,,,,,,,,,,,,,,,,,,,,,,,,,,,,,,,,,,,,,,,,,,,,,,,,,,,,,,,,,,,,,,,,,,,,,,,,,,,,,,,,,,,,,,,,,,,,,,,,,,,,,,,,,,,,,,,,,,,,,,,,,,,,,,,,,,,,
92,michelle pamela torres vazques ,republica francesa,4,9,f,balon ,1,muy,1,balon,1,"si,porque tiene sentido",2,,,mi hermano grita mucho,3,una pelota pinpojos,1,una pelota ,1,PRUEBA 2,14,nubes de leche,como son las nubes?,de color leche son esponjados,,leche,color,esponjosa,,metafora,2,15,piel de seda,como es la piel,suave,,seda ,suave,,,,metafora ,3,16,mirada ardiente,como es la mirada?,fea,,ardiente ,mirar feo,,,,metafora,3,17,ojos amargos,como son los ojos?,como le cae limon,,amargos ,limon,,,,imaginativo,1,18,el verano viene,que ocurre con el verano?,cuando llega,,viene,llegar,,,metafora,2,19,la navidad llego,que significa esta frase?,cuando llego la navidad es una epoca,navidad,,epoca,,,convencional ,2,PRUEBA 3,,,,,,,,,,,,,,,,,,,,,,,,,,,,,,,,,,,,,,,,,,,,,,,,,,,,,,,,,,,,,,,,,,,,,,,,,,,,,,,,,,,,,,,,,,,,,,,,,,,,,,,,,,,,,,,,,,,,,,,,,,,,,,,,,,,,,,,,,,,,,,,,,,,,,,,,,,,,,,,,,,,,,,,,,,,,,,,,,,,,,,,,,,,,,,,,,,,,,,,,,,,,,,,,,,,,,,,,,,,,,,,,,,,,
93,diana seleste jacobo,republica francesa,4,9,f,hermanito,2,sol,1,pelota de pelos,1,,,"no, porque las pelotas no cantan*",1,mi hermanito tiene una pelota de gritos,1,pulsera puede ser algo de pelos,1,mi pelota de planta es una normal,1,PRUEBA 2,14,nubes de leche,como son las nubes?,"suaves, esponjosas",nubes,leche,suave,esponjoso,,incierto ,2,15,piel de seda,como es la piel,suave y dura,piel,seda ,suave,dura,,,incierto,2,16,mirada ardiente,como es la mirada?,normal y suave,mirada,,normal,,,,desvinculada,1,17,ojos amargos,como son los ojos?,normales y se pegan,,,,,,,desvinculado,1,18,el verano viene,que ocurre con el verano?,ocurre que hace calor y nadas,verano,,calor,nadar,,metafora,2,19,la navidad llego,que significa esta frase?,que ya es hora de festejar navidad,navidad,,festejar,,,convencional ,2,PRUEBA 3,,,,,,,,,,,,,,,,,,,,,,,,,,,,,,,,,,,,,,,,,,,,,,,,,,,,,,,,,,,,,,,,,,,,,,,,,,,,,,,,,,,,,,,,,,,,,,,,,,,,,,,,,,,,,,,,,,,,,,,,,,,,,,,,,,,,,,,,,,,,,,,,,,,,,,,,,,,,,,,,,,,,,,,,,,,,,,,,,,,,,,,,,,,,,,,,,,,,,,,,,,,,,,,,,,,,,,,,,,,,,,,,,,,,
94,vanessa juliana mendoza martine,republica francesa,4,9,f,pelota,1,gran jaguar,1,hermano,3,"si,tienen sentido",2,,,es una presion,2,alguien que es bueno,2,algo que te dan ganas de decirlo,2,PRUEBA 2,14,nubes de leche,como son las nubes?,no hay,,,,,,imposible,1,15,piel de seda,como es la piel,es reseca,piel,reseca,,,,,desvinculada,2,16,mirada ardiente,como es la mirada?,es algo asustador,,ardiente ,asustador ,,,,metafora,3,17,ojos amargos,como son los ojos?,muy amargo,,amargo,amargo,,,,literal,1,18,el verano viene,que ocurre con el verano?,es tranquilo,verano,,tranquilo,,,metafora,2,19,la navidad llego,que significa esta frase?,es alegre,navidad,,alegre,,,convencional ,2,PRUEBA 3,,,,,,,,,,,,,,,,,,,,,,,,,,,,,,,,,,,,,,,,,,,,,,,,,,,,,,,,,,,,,,,,,,,,,,,,,,,,,,,,,,,,,,,,,,,,,,,,,,,,,,,,,,,,,,,,,,,,,,,,,,,,,,,,,,,,,,,,,,,,,,,,,,,,,,,,,,,,,,,,,,,,,,,,,,,,,,,,,,,,,,,,,,,,,,,,,,,,,,,,,,,,,,,,,,,,,,,,,,,,,,,,,,,,
95,joana lizbeth rojas o.,republica francesa,4,9,f,nino,1,WW,0,mama,2,"si,porque rebota",1,,,la pelota tiene gritos,1,porque no tiene pelos ,1,de donde puede tener mas de todos,1,PRUEBA 2,14,nubes de leche,como son las nubes?,de leche es cuando de todo de todos,,,,,,invalida,1,15,piel de seda,como es la piel,que no pueden de todos que posque de todo,,,,,,,invalida,1,16,mirada ardiente,como es la mirada?,de todos que nos de todos demos de todos de todos,,,,,,,invalida,1,17,ojos amargos,como son los ojos?,de que mas de todos que no de todos que no,,,,,,,invalida,1,18,el verano viene,que ocurre con el verano?,mas de cuando puede demas de todos,,,,,,invalida,1,19,la navidad llego,que significa esta frase?,de todos que no pueden mas que no de todos de que.,,,,,,invalida,1,PRUEBA 3,,,,,,,,,,,,,,,,,,,,,,,,,,,,,,,,,,,,,,,,,,,,,,,,,,,,,,,,,,,,,,,,,,,,,,,,,,,,,,,,,,,,,,,,,,,,,,,,,,,,,,,,,,,,,,,,,,,,,,,,,,,,,,,,,,,,,,,,,,,,,,,,,,,,,,,,,,,,,,,,,,,,,,,,,,,,,,,,,,,,,,,,,,,,,,,,,,,,,,,,,,,,,,,,,,,,,,,,,,,,,,,,,,,,
