175,luis alberto hernandez flores,republica francesa,6,11,m,balon,1,perro,1,gato,3,,,"no, porque yo no he visto una pelota que canta",1,que el hermano es travieso y grita mucho,3,pues un pajaro porque es muy peludo,3,porque es una pelota bonita y de plata,1,PRUEBA 2,,,,,,,,,,,,,,,,,,,,,,,,,,,,,,,,,,,,,,,,,,,,,,,,,,,,,,,,,,,,,,,,,,,,,,PRUEBA 3,19,piernas de acero,3,no,1,que un humano tenga piernas duras,1,por que es imposible que a un humano se le ajuste la pierna,1,m,acero,duras,,20,sobre de papel,3,si,1,si si lo doblas queda el sobre,1,si por que doblando varias veces queda,1,l,,,,21,calendario de zacate,3,no,1,que haces un calendario de pasto,1,no por que es imposible hacerlo con pasto,1,ai,pasto,,,22,carbon ardiente,3,si,1,si si lo prendes arde en llamas,1,si si lo prendes arde en llamas,1,l,llamadas,,,23,ojos amargos,3,si,1,que llora,1,si por que pudo llorar,1,m,llora,,24,calceta de plata,3,no,1,que es de plata,1,no por que doleria,1,a,doleria,,25,la cebolla llega,2,no,1,la cebolla llego,0,no pueden caminar,1,ai,cebolla,caminar,26,las gaviotas vuelan,0,si,1,las gaviotas si vuelve ,1,si vuelan con sus alas,1,l,vuelan,alas,27,la noche llega,2,si,1,la noche llega,0,la noche si llega,1,m,,,,cristina,19,piernas de acero,3,no,1,que un humano tenga piernas duras,1,por que es imposible que a un humano se le ajuste la pierna,1,m,acero,duras,,20,sobre de papel,3,si,1,si si lo doblas queda el sobre,1,si por que doblando varias veces queda,1,l,,,,21,calendario de zacate,3,no,1,que haces un calendario de pasto,1,no por que es imposible hacerlo con pasto,1,ai,pasto,,,22,carbon ardiente,3,si,1,si si lo prendes arde en llamas,1,si si lo prendes arde en llamas,1,l,llamadas,,,23,ojos amargos,3,si,1,que llora,1,si por que pudo llorar,1,m,llora,,24,calceta de plata,3,no,1,que es de plata,1,no por que doleria,1,a,doleria,,25,la cebolla llega,2,no,1,la cebolla llego,0,no pueden caminar,1,ai,cebolla,caminar,26,las gaviotas vuelan,0,si,1,las gaviotas si vuelve ,1,si vuelan con sus alas,1,l,vuelan,alas,27,la noche llega,2,si,1,la noche llega,0,la noche si llega,1,m,,,,cristina
176,leonardo perez posada,republica francesa,6,11,m,sol,3,la luna,3,gato,3,"si, porque se refiere a su mama",3,,,que su hermano grita mucho y todo lo que dice tiene que ver con pelotas,3,perro porque ya que todo lo ve como una pelota todo es una pelota,2,pelota de plataes la luna porque el sol es una pelota de fuego,2,PRUEBA 2,,,,,,,,,,,,,,,,,,,,,,,,,,,,,,,,,,,,,,,,,,,,,,,,,,,,,,,,,,,,,,,,,,,,,,PRUEBA 3,19,piernas de acero,3,no,1,que las piernas son fuertes,1,porque si tuviera piernas de acero me pesarian,1,mi,acero,fuertes,,20,sobre de papel,3,si,1,los sobres son de papel,1,si es posible ya que los sobres son de papel,1,l,,,,21,calendario de zacate,3,no,1,no es posible,1,no puede haber un calendario de zacate,1,ai,,,,22,carbon ardiente,3,si,1,que el carbon esta prendido,1,por que el carbon se usa para cocinar,1,l,prendiendo,,,23,ojos amargos,3,no,1,ojos verde,1,no es verdad no es posible ,1,m,verde,,24,calceta de plata,2,no,1,calceta de plata,0,me pesaria y me caeria,1,a,,,25,la cebolla llega,3,si,1,la cebolla llega a los ojos,1,si por que llega a los ojos y te hace llorar,1,am,llorar,,26,las gaviotas vuelan,0,si,1,las gaviotas vuelan ,0,si por que las gaviotas vuelan,1,l,,,27,la noche llega,3,si,1,cuando se hace de noche,1,cuando se hace de noche,1,m,,,,cristina,19,piernas de acero,3,no,1,que las piernas son fuertes,1,porque si tuviera piernas de acero me pesarian,1,mi,acero,fuertes,,20,sobre de papel,3,si,1,los sobres son de papel,1,si es posible ya que los sobres son de papel,1,l,,,,21,calendario de zacate,3,no,1,no es posible,1,no puede haber un calendario de zacate,1,ai,,,,22,carbon ardiente,3,si,1,que el carbon esta prendido,1,por que el carbon se usa para cocinar,1,l,prendiendo,,,23,ojos amargos,3,no,1,ojos verde,1,no es verdad no es posible ,1,m,verde,,24,calceta de plata,2,no,1,calceta de plata,0,me pesaria y me caeria,1,a,,,25,la cebolla llega,3,si,1,la cebolla llega a los ojos,1,si por que llega a los ojos y te hace llorar,1,am,llorar,,26,las gaviotas vuelan,0,si,1,las gaviotas vuelan ,0,si por que las gaviotas vuelan,1,l,,,27,la noche llega,3,si,1,cuando se hace de noche,1,cuando se hace de noche,1,m,,,,cristina
177,diego miguel solari huato,republica francesa,6,11,m,papa,2,cartera,1,perro,3,,,"no, porque las pelotas no cantan",1,que su hermano grita y llora mucho,3,"gato, hamster porque los dos tienen mucho pelo",3,cartera o dinero,1,PRUEBA 2,,,,,,,,,,,,,,,,,,,,,,,,,,,,,,,,,,,,,,,,,,,,,,,,,,,,,,,,,,,,,,,,,,,,,,PRUEBA 3,19,piernas de acero,3,si ,1,que son muy fuertes,1,es posible por que se pueden hacer,1,m,acero,fuertes,,20,sobre de papel,3,si,1,un sobre hecho de papel,1,si por que ya se ha hecho,1,l,,,,21,calendario de zacate,2,no,1,un calendario de zacate,0,no es posible hacer cocinada con un zacate,1,a,,,,22,carbon ardiente,3,si,1,carbon quemandose,1,ya esta hecho solo lo queman es carbon,1,l,carbon,quemado,,23,ojos amargos,1,no,0,,0,por que nadie amarga sus ojos,1,m,,,24,calceta de plata,2,no,1,una calceta hecha de plata,0,por que alguien haria una calceta de plata,1,a,,,25,la cebolla llega,2,no,1,,0,por que una cebolla no camina,1,,,,26,las gaviotas vuelan,0,si,1,una gaviota volaria,1,si por que ya hay gaviotas que vuelan,1,l,,,27,la noche llega,3,si,1,que ya es noche,1,si por que ya en la noche es noche,1,m,,,,cristina,19,piernas de acero,3,si ,1,que son muy fuertes,1,es posible por que se pueden hacer,1,m,acero,fuertes,,20,sobre de papel,3,si,1,un sobre hecho de papel,1,si por que ya se ha hecho,1,l,,,,21,calendario de zacate,2,no,1,un calendario de zacate,0,no es posible hacer cocinada con un zacate,1,a,,,,22,carbon ardiente,3,si,1,carbon quemandose,1,ya esta hecho solo lo queman es carbon,1,l,carbon,quemado,,23,ojos amargos,1,no,0,,0,por que nadie amarga sus ojos,1,m,,,24,calceta de plata,2,no,1,una calceta hecha de plata,0,por que alguien haria una calceta de plata,1,a,,,25,la cebolla llega,2,no,1,,0,por que una cebolla no camina,1,,,,26,las gaviotas vuelan,0,si,1,una gaviota volaria,1,si por que ya hay gaviotas que vuelan,1,l,,,27,la noche llega,3,si,1,que ya es noche,1,si por que ya en la noche es noche,1,m,,,,cristina
178,luis fernando lopez mendoza ,republica francesa,6,11,m,sol,3,la moneda,1,cabeza,3,,,"no, porque las pelotas no hablan",1,que mi hermanita grita,3,la cabeza porque tiene pelo,1,una moneda,1,PRUEBA 2,,,,,,,,,,,,,,,,,,,,,,,,,,,,,,,,,,,,,,,,,,,,,,,,,,,,,,,,,,,,,,,,,,,,,,PRUEBA 3,19,piernas de acero,3,si ,1,que tu pierna sea de acero ,1,por que si ya no tienes pie te pueden poner una pierna de acero,1,m,,,,20,sobre de papel,2,si,1,uh sobre de papel,0,por que eso si existe ,1,l,,,,21,calendario de zacate,2,no,1,es una calenadario,0,no se cual es el calendariol de zacate,1,a,,,,22,carbon ardiente,2,si,1,es carbon,0,por que el carbon arde cuando prendes el fuego,1,l,carbon,fuego,,23,ojos amargos,2,no,1,ojos,0,los ojos no pueden ser amargos no son limones,1,m,limones,,24,calceta de plata,3,no,1,es una calceta ,1,no por que no se puede eso no seria una calceta ,1,a,,,25,la cebolla llega,3,si,1,que la cebolla esta aqui,1,si por que es cuando llevas la cebolla a la cocina,1,al,llevar,,26,las gaviotas vuelan,0,si,1,un pajaro,1,si por que las gaviotas son aves que pueden volar,1,l,,,27,la noche llega,3,si,1,ya casi es noche,1,por que es cuando ya casi es noche,1,m,,,,cristina,19,piernas de acero,3,si ,1,que tu pierna sea de acero ,1,por que si ya no tienes pie te pueden poner una pierna de acero,1,m,,,,20,sobre de papel,2,si,1,uh sobre de papel,0,por que eso si existe ,1,l,,,,21,calendario de zacate,2,no,1,es una calenadario,0,no se cual es el calendariol de zacate,1,a,,,,22,carbon ardiente,2,si,1,es carbon,0,por que el carbon arde cuando prendes el fuego,1,l,carbon,fuego,,23,ojos amargos,2,no,1,ojos,0,los ojos no pueden ser amargos no son limones,1,m,limones,,24,calceta de plata,3,no,1,es una calceta ,1,no por que no se puede eso no seria una calceta ,1,a,,,25,la cebolla llega,3,si,1,que la cebolla esta aqui,1,si por que es cuando llevas la cebolla a la cocina,1,al,llevar,,26,las gaviotas vuelan,0,si,1,un pajaro,1,si por que las gaviotas son aves que pueden volar,1,l,,,27,la noche llega,3,si,1,ya casi es noche,1,por que es cuando ya casi es noche,1,m,,,,cristina
179,jesus emanuel garcia,republica francesa,6,11,m,rebota,1,solta,1,gato,3,,,"no,porque no es tan comprensible",1,grita siempre me grita,3,"perro, hamster, oso o monos",3,que tiene mucho dinero,2,PRUEBA 2,,,,,,,,,,,,,,,,,,,,,,,,,,,,,,,,,,,,,,,,,,,,,,,,,,,,,,,,,,,,,,,,,,,,,,PRUEBA 3,19,piernas de acero,3,si ,1,tiene las piernas muy fuertes,1,por que alguein puede entrenar la pierna,1,m,acero,fuertes,,20,sobre de papel,3,si,1,para mandar cartas,1,puedes mandar mendaje a cualquier pais,1,l,cartas,,,21,calendario de zacate,3,si,1,con lo que te banas,1,porque te puedess banar,1,a,banar,,,22,carbon ardiente,3,si,1,a veces es toxico,1,a veces te va hacer mal para tu salud,1,l,carbon,toxico,,23,ojos amargos,3,si,1,tristes ,1,triste por algo,1,m,tristes,,24,calceta de plata,2,si,1,calcetas grises,1,y brillantes,,am,gris,brillante,25,la cebolla llega,2,si,1,ara llorar a todos,1,tristeza,0,am,llorar,tristeza,26,las gaviotas vuelan,0,si,1,con su alas emplumadas,1,vuelan con plumas,1,l,alas,emplumadas,27,la noche llega,3,si ,1,a dormir y descanzar,1,para descanzar,1,m,dormir,descasar,,cristina,19,piernas de acero,3,si ,1,tiene las piernas muy fuertes,1,por que alguein puede entrenar la pierna,1,m,acero,fuertes,,20,sobre de papel,3,si,1,para mandar cartas,1,puedes mandar mendaje a cualquier pais,1,l,cartas,,,21,calendario de zacate,3,si,1,con lo que te banas,1,porque te puedess banar,1,a,banar,,,22,carbon ardiente,3,si,1,a veces es toxico,1,a veces te va hacer mal para tu salud,1,l,carbon,toxico,,23,ojos amargos,3,si,1,tristes ,1,triste por algo,1,m,tristes,,24,calceta de plata,2,si,1,calcetas grises,1,y brillantes,,am,gris,brillante,25,la cebolla llega,2,si,1,ara llorar a todos,1,tristeza,0,am,llorar,tristeza,26,las gaviotas vuelan,0,si,1,con su alas emplumadas,1,vuelan con plumas,1,l,alas,emplumadas,27,la noche llega,3,si ,1,a dormir y descanzar,1,para descanzar,1,m,dormir,descasar,,cristina
180,andres rodriguez arias,republica francesa,6,11,m,sol,3,la luna,3,papa,2,,,"no,porque no puede haber un objeto que cante, eso seria imposible y absurdo ",1,que un nino llora y grita cuando no le hacen caso o algo asi,3,una pelota grande depende a que se refiera de pelos o el pelo ,1,le puse luna porque tiene casi el mismo color,3,PRUEBA 2,,,,,,,,,,,,,,,,,,,,,,,,,,,,,,,,,,,,,,,,,,,,,,,,,,,,,,,,,,,,,,,,,,,,,,PRUEBA 3,19,piernas de acero,3,si,1,piernas fuertes,1,se refierea piernas fuertes  si se reiere a una pierna de acero,1,m,acero,fuertes,,20,sobre de papel,3,si,1,es como estar sobre el papel,1,es es por estar recargado en papel no sobre el papel,1,l,,,,21,calendario de zacate,3,no,1,es tener  un calendario de ese material,1,que no puede haber asi pero no lo es,1,a,,,,22,carbon ardiente,3,si,1,que el carbon esta caliente,1,si qeu el carbon esta caliente,1,l,ardiente,caliente,,23,ojos amargos,2,no,1,NN,0,no lo creo que sea posible,1,m,,,24,calceta de plata,2,no,1,que tengas un calcetin de tu suerte,1,no por que no hay algo parecido pero puede haber,,a,suerte,,25,la cebolla llega ,3,si,1,algo que te llego,1,si puede tener sentido y no ala ves,1,a,,,26,las gaviotas vuelan,0,si,1,que algo puede pasar,1,por que si vuelan y a la ves no,1,l,,,27,la noche llega,3,si,1,que se hace de noche,1,si por que la noche se acerca,1,m,,,,cristina,19,piernas de acero,3,si,1,piernas fuertes,1,se refierea piernas fuertes  si se reiere a una pierna de acero,1,m,acero,fuertes,,20,sobre de papel,3,si,1,es como estar sobre el papel,1,es es por estar recargado en papel no sobre el papel,1,l,,,,21,calendario de zacate,3,no,1,es tener  un calendario de ese material,1,que no puede haber asi pero no lo es,1,a,,,,22,carbon ardiente,3,si,1,que el carbon esta caliente,1,si qeu el carbon esta caliente,1,l,ardiente,caliente,,23,ojos amargos,2,no,1,NN,0,no lo creo que sea posible,1,m,,,24,calceta de plata,2,no,1,que tengas un calcetin de tu suerte,1,no por que no hay algo parecido pero puede haber,,a,suerte,,25,la cebolla llega ,3,si,1,algo que te llego,1,si puede tener sentido y no ala ves,1,a,,,26,las gaviotas vuelan,0,si,1,que algo puede pasar,1,por que si vuelan y a la ves no,1,l,,,27,la noche llega,3,si,1,que se hace de noche,1,si por que la noche se acerca,1,m,,,,cristina
181,emilio garduno servin,republica francesa,6,12,m,hombre,3,que,3,perro,3,"si, porque es una forma de describir a alguien",3,,,que su hermano grita mucho,3,un amigo porque puede tener mucho pelo,3,que es una persona fuerte,3,PRUEBA 2,,,,,,,,,,,,,,,,,,,,,,,,,,,,,,,,,,,,,,,,,,,,,,,,,,,,,,,,,,,,,,,,,,,,,,PRUEBA 3,10,estrellas de cristal ,2,no,1,que no hay,0,porque es una fantasia,1,m,,,,11,vestidos de terciopelo ,3,si,1,que se pueden hacer,1,por que hay vestidos de tela,1,l,,,,12,zapatos de miel ,3,no,1,que no hay,1,por que se caeria la miel y es comestible,1,ai,miel,comestible,,13,escultura de piedra ,3,si,1,que se pueden acer,1,por que es piedra y se puede modificar,1,l,piedra,modificar,,14,alma de hierro ,2,no,1,que no hay,0,por que nadie es tan malo,1,m,hierro,malo,15,banqueta abrigadora ,2,no,1,que no existe,0,no es posible,1,ai,,,16,la silla ya llego,3,no,1,que no llegue,1,por que la silla no camina,1,a,camina,,17,los atletas corren ,3,si,1,que los atletas corren,1,por que hay lugares donde ellos corren,1,l,,,18,el tiempo alcanza,3,si,1,que hay tiempo para todo,1,por que cada momento tiene un tiempo,1,m,tiempo,momento,,cristina,10,estrellas de cristal ,2,no,1,que no hay,0,porque es una fantasia,1,m,,,,11,vestidos de terciopelo ,3,si,1,que se pueden hacer,1,por que hay vestidos de tela,1,l,,,,12,zapatos de miel ,3,no,1,que no hay,1,por que se caeria la miel y es comestible,1,ai,miel,comestible,,13,escultura de piedra ,3,si,1,que se pueden acer,1,por que es piedra y se puede modificar,1,l,piedra,modificar,,14,alma de hierro ,2,no,1,que no hay,0,por que nadie es tan malo,1,m,hierro,malo,15,banqueta abrigadora ,2,no,1,que no existe,0,no es posible,1,ai,,,16,la silla ya llego,3,no,1,que no llegue,1,por que la silla no camina,1,a,camina,,17,los atletas corren ,3,si,1,que los atletas corren,1,por que hay lugares donde ellos corren,1,l,,,18,el tiempo alcanza,3,si,1,que hay tiempo para todo,1,por que cada momento tiene un tiempo,1,m,tiempo,momento,,cristina
182,luis daniel zamora ortiz,republica francesa,6,12,m,senor,2,la llanta,2,amigo,2,,,"no, porque no hay pelotas que canten",1,que su hermano grita mucho,3,tiene muchos pelos o podria ser un animal,3,es dura,2,PRUEBA 2,,,,,,,,,,,,,,,,,,,,,,,,,,,,,,,,,,,,,,,,,,,,,,,,,,,,,,,,,,,,,,,,,,,,,,PRUEBA 3,10,estrellas de cristal ,2,no,1,es una metafora,,por que no hay estrellas asi,1,mi,,,,11,vestidos de terciopelo ,3,si,1,los vestidos estan hechos de tela,1,pues es real los vestidos estan hechos de tela,1,l,,,,12,zapatos de miel ,2,no,1,metafora,0,no existen esos zapatos seria para una frase diferente,1,ai,,,,13,escultura de piedra ,3,si,1,existen las esculturas,1,las esculturas de piedra son reales,1,l,,,,14,alma de hierro ,3,no,1,pero es como ser fuerte,1,nisiquiera se pueden ver las almas,1,mi,hierro,fuerte,15,banqueta abrigadora ,2,no,1,no hay banquetas asi,0,no pueden construir algo asi,1,ai,,,16,la silla ya llego,3,no,1,una silla no se mueve sola,1,podria ser que alguien se llame silla,1,a,mover,,17,los atletas corren ,3,si,1,estam entrenados para eso,1,pues si ellos corren,1,l,entrenados,,18,el tiempo alcanza,3,si,1,a veces si hay tiempo,1,si hay tiempo,1,m,,,,cristina,10,estrellas de cristal ,2,no,1,es una metafora,,por que no hay estrellas asi,1,mi,,,,11,vestidos de terciopelo ,3,si,1,los vestidos estan hechos de tela,1,pues es real los vestidos estan hechos de tela,1,l,,,,12,zapatos de miel ,2,no,1,metafora,0,no existen esos zapatos seria para una frase diferente,1,ai,,,,13,escultura de piedra ,3,si,1,existen las esculturas,1,las esculturas de piedra son reales,1,l,,,,14,alma de hierro ,3,no,1,pero es como ser fuerte,1,nisiquiera se pueden ver las almas,1,mi,hierro,fuerte,15,banqueta abrigadora ,2,no,1,no hay banquetas asi,0,no pueden construir algo asi,1,ai,,,16,la silla ya llego,3,no,1,una silla no se mueve sola,1,podria ser que alguien se llame silla,1,a,mover,,17,los atletas corren ,3,si,1,estam entrenados para eso,1,pues si ellos corren,1,l,entrenados,,18,el tiempo alcanza,3,si,1,a veces si hay tiempo,1,si hay tiempo,1,m,,,,cristina
183,tristan alejandro gaytan p.,republica francesa,6,12,m,enemigo,3,el amigo,2,gato,3,,,"no, porque las pelotas no cantan solo con la imaginacion",1,que su hermano es muy enojon,3,"un animal, perro, gato, cebra porque tienen pelos*",3,es alguien una persona que quieras como tu mama o un amigo,3,PRUEBA 2,,,,,,,,,,,,,,,,,,,,,,,,,,,,,,,,,,,,,,,,,,,,,,,,,,,,,,,,,,,,,,,,,,,,,,PRUEBA 3,10,estrellas de cristal ,2,no,1,no creo que sea posible,0,por que de ese modo se romperia,1,mi,romper,,,11,vestidos de terciopelo ,2,si,1,si veo que sea posible,0,aunque se llegarian a romper los puedes arreglar,1,l,,,,12,zapatos de miel ,2,no,1,no creo que sea posible,0,no por que cada ves que te los quites las abejas vendrian por ti ,1,ai,miel,abejas,,13,escultura de piedra ,2,si,1,si creo que sea posible,0,si se puede ya que existen esas esculturas,1,l,,,,14,alma de hierro ,2,si ,1,que se fueron,0,por que para mi eso seria un cumplido,1,m,,,15,banqueta abrigadora ,3,no,1,para mi significa que una banqueta te mantiene en calor,1,no por que las banque tas no te mantienen en calor,1,a,calor,,16,la silla ya llego,3,no,1,que una silla camina,1,no es posible por que las sillas no caminan,1,a,camina,,17,los atletas corren ,3,si,1,una s mujeres hacen ejercicio,1,si por que si existe gente que hace ejercicio,1,l,ejercicio,,18,el tiempo alcanza,3,si,1,significa que el tiempo va demasiado rapido,1,si es posible por que el tiempo si va rapido,1,m,tiempo,rapido,,cristina,10,estrellas de cristal ,2,no,1,no creo que sea posible,0,por que de ese modo se romperia,1,mi,romper,,,11,vestidos de terciopelo ,2,si,1,si veo que sea posible,0,aunque se llegarian a romper los puedes arreglar,1,l,,,,12,zapatos de miel ,2,no,1,no creo que sea posible,0,no por que cada ves que te los quites las abejas vendrian por ti ,1,ai,miel,abejas,,13,escultura de piedra ,2,si,1,si creo que sea posible,0,si se puede ya que existen esas esculturas,1,l,,,,14,alma de hierro ,2,si ,1,que se fueron,0,por que para mi eso seria un cumplido,1,m,,,15,banqueta abrigadora ,3,no,1,para mi significa que una banqueta te mantiene en calor,1,no por que las banque tas no te mantienen en calor,1,a,calor,,16,la silla ya llego,3,no,1,que una silla camina,1,no es posible por que las sillas no caminan,1,a,camina,,17,los atletas corren ,3,si,1,una s mujeres hacen ejercicio,1,si por que si existe gente que hace ejercicio,1,l,ejercicio,,18,el tiempo alcanza,3,si,1,significa que el tiempo va demasiado rapido,1,si es posible por que el tiempo si va rapido,1,m,tiempo,rapido,,cristina
184,emmanuel bolanos arteaga,republica francesa,6,12,m,amigo,1,la pelota,1,pelota,1,,,"no, porque las pelotas no hablan",1,que su hermano grita,3,una bola de pelos,1,que la pelota es dura,1,PRUEBA 2,,,,,,,,,,,,,,,,,,,,,,,,,,,,,,,,,,,,,,,,,,,,,,,,,,,,,,,,,,,,,,,,,,,,,,PRUEBA 3,10,estrellas de cristal ,3,no,1,que las estrellas son de cristal,1,las estrellas no brillan si son de cristal,1,m,,,,11,vestidos de terciopelo ,3,si,1,que se pueden hacer vestidos de tela,1,por que con la tela se pueden formar vestidos,1,l,,,,12,zapatos de miel ,3,no,1, no hay zapatos de miel,1,no es posible por que la miel no es firme,1,ai,,,,13,escultura de piedra ,3,si,1,forma de una persona,1,si es posible por que se le puede dar forma  a la piedra,1,l,,,,14,alma de hierro ,3,si ,1,que la persona es fuerte,1,si es posible aunque la persona tenga problemas es fuerte,1,m,hierro,fuerte,15,banqueta abrigadora ,3,si,1,la tapa el frio,1,es posible por que puede cubrir el aire,1,a,aire,,16,la silla ya llego,3,no,1,que camina la silla,1,no es posible las sillas no se mueven,1,a,mover,,17,los atletas corren ,3,si,1,que pueden correr,1,es posible si se dedica a correr,1,l,,,18,el tiempo alcanza,3,si,1,que tiene tiempo,1,si es posible por que tiene tiempo para llegar,1,m,alcanza,llegar,,cristina,10,estrellas de cristal ,3,no,1,que las estrellas son de cristal,1,las estrellas no brillan si son de cristal,1,m,,,,11,vestidos de terciopelo ,3,si,1,que se pueden hacer vestidos de tela,1,por que con la tela se pueden formar vestidos,1,l,,,,12,zapatos de miel ,3,no,1, no hay zapatos de miel,1,no es posible por que la miel no es firme,1,ai,,,,13,escultura de piedra ,3,si,1,forma de una persona,1,si es posible por que se le puede dar forma  a la piedra,1,l,,,,14,alma de hierro ,3,si ,1,que la persona es fuerte,1,si es posible aunque la persona tenga problemas es fuerte,1,m,hierro,fuerte,15,banqueta abrigadora ,3,si,1,la tapa el frio,1,es posible por que puede cubrir el aire,1,a,aire,,16,la silla ya llego,3,no,1,que camina la silla,1,no es posible las sillas no se mueven,1,a,mover,,17,los atletas corren ,3,si,1,que pueden correr,1,es posible si se dedica a correr,1,l,,,18,el tiempo alcanza,3,si,1,que tiene tiempo,1,si es posible por que tiene tiempo para llegar,1,m,alcanza,llegar,,cristina
185,mario gael robles guillen,republica francesa,6,12,m,fireball,1,mi dinero,2,perro,3,"si, porque canta canciones",1,,,porque es muy escandalosa,3,porque tiene mucho pelo,2,el dinero,2,PRUEBA 2,,,,,,,,,,,,,,,,,,,,,,,,,,,,,,,,,,,,,,,,,,,,,,,,,,,,,,,,,,,,,,,,,,,,,,PRUEBA 3,10,estrellas de cristal ,2,si,1,que si se puede ir,0,se puede hacer con cristal y un molde de estrella,1,m,,,,11,vestidos de terciopelo ,3,si,1,si se puede ir,1,se puede hacer con tela y en una maquina de coser,1,l,,,,12,zapatos de miel ,3,no,1,no creo que pueda ir,1,no se puede hacer,1,ai,,,,13,escultura de piedra ,2,si,1,si se puede hacer,0,si se puede hacer una piedra,1,l,,,,14,alma de hierro ,2,no,1,no creo ,0,no creo que exista un alma de hierro,1,mli,,,15,banqueta abrigadora ,3,no,1,no puede ser,1,no puede existir una banqueta abrigadora,1,ai,,,16,la silla ya llego,2,si,1,si puede ser,0,ya trageron las sillas a la mesa,1,a,,,17,los atletas corren ,3,si,1,si corren,1,si pueden correr,1,l,,,18,el tiempo alcanza,2,no,1,no puede,0,nos puede el tiempo alcanzar,1,m,,,,cristina,10,estrellas de cristal ,2,si,1,que si se puede ir,0,se puede hacer con cristal y un molde de estrella,1,m,,,,11,vestidos de terciopelo ,3,si,1,si se puede ir,1,se puede hacer con tela y en una maquina de coser,1,l,,,,12,zapatos de miel ,3,no,1,no creo que pueda ir,1,no se puede hacer,1,ai,,,,13,escultura de piedra ,2,si,1,si se puede hacer,0,si se puede hacer una piedra,1,l,,,,14,alma de hierro ,2,no,1,no creo ,0,no creo que exista un alma de hierro,1,mli,,,15,banqueta abrigadora ,3,no,1,no puede ser,1,no puede existir una banqueta abrigadora,1,ai,,,16,la silla ya llego,2,si,1,si puede ser,0,ya trageron las sillas a la mesa,1,a,,,17,los atletas corren ,3,si,1,si corren,1,si pueden correr,1,l,,,18,el tiempo alcanza,2,no,1,no puede,0,nos puede el tiempo alcanzar,1,m,,,,cristina
186,axel gibran hernandez olvera,republica francesa,6,12,m,balon,2,hermano,2,amigo,3,,,"no, porque no creo que vayaa cantar",1,que se la pasa gritando,3,mi perro porque tiene pelos,3,que es duro como la plata,2,PRUEBA 2,,,,,,,,,,,,,,,,,,,,,,,,,,,,,,,,,,,,,,,,,,,,,,,,,,,,,,,,,,,,,,,,,,,,,,PRUEBA 3,10,estrellas de cristal ,3,si,1,es como si la hubieran querido de cristal alguien o algo,1,porque como dicen que el espacio se congela ls cosas por eso,1,m,,,,11,vestidos de terciopelo ,3,si,1,que la tela la sacaron del borrego ,1,por que fue sacado del borrego y luego se crea,1,l,borrego,,,12,zapatos de miel ,2,no,1,yo no creo que se pueda hacer,0,por que si se hace seria imposible que se derrita,1,ai,miel ,derretir,,13,escultura de piedra ,2,si,1,una montana,0,por que es algo natural,1,lm,,,,14,alma de hierro ,3,si ,1,que eresfuerte por dentro ,1,por que si puedes ser dura como lo roca,1,m,fuerte,dura,15,banqueta abrigadora ,3,no,1,que te abriga,1,no creo por que no va a salir con una cobija a cobijarme,1,a,cobijarme,,16,la silla ya llego,3,si,1,que pediste que te la arreglaran y llego,1,la mandaste a arreglar y luego te la trajeron,1,a,,,17,los atletas corren ,3,si,1,que tienen que hacer ejercicio,1,por que hacen ejercicio,1,l,ejercicio,,18,el tiempo alcanza,3,si,1,que te alcanza para hacer algo,1,que te alcanza para hacer las cosas,1,m,,,,cristina,10,estrellas de cristal ,3,si,1,es como si la hubieran querido de cristal alguien o algo,1,porque como dicen que el espacio se congela ls cosas por eso,1,m,,,,11,vestidos de terciopelo ,3,si,1,que la tela la sacaron del borrego ,1,por que fue sacado del borrego y luego se crea,1,l,borrego,,,12,zapatos de miel ,2,no,1,yo no creo que se pueda hacer,0,por que si se hace seria imposible que se derrita,1,ai,miel ,derretir,,13,escultura de piedra ,2,si,1,una montana,0,por que es algo natural,1,lm,,,,14,alma de hierro ,3,si ,1,que eresfuerte por dentro ,1,por que si puedes ser dura como lo roca,1,m,fuerte,dura,15,banqueta abrigadora ,3,no,1,que te abriga,1,no creo por que no va a salir con una cobija a cobijarme,1,a,cobijarme,,16,la silla ya llego,3,si,1,que pediste que te la arreglaran y llego,1,la mandaste a arreglar y luego te la trajeron,1,a,,,17,los atletas corren ,3,si,1,que tienen que hacer ejercicio,1,por que hacen ejercicio,1,l,ejercicio,,18,el tiempo alcanza,3,si,1,que te alcanza para hacer algo,1,que te alcanza para hacer las cosas,1,m,,,,cristina
